Date,Domain,Metric,Region,Provider Code,Provider Name,Numerator,Denominator
01/05/2025,A&E,>12 hours,East,RWG,West Hertfordshire Hospitals Teaching NHS Trust,700,8300
01/05/2025,A&E,>12 hours,East,RGR,West Suffolk NHS Foundation Trust,235,8155
01/05/2025,A&E,>12 hours,London,RF4,"Barking, Havering and Redbridge University Hospitals NHS Trust",2390,15595
01/05/2025,A&E,>12 hours,London,R1H,Barts Health NHS Trust,3730,26410
01/05/2025,A&E,>12 hours,London,RQM,Chelsea and Westminster Hospital NHS Foundation Trust,550,12535
01/05/2025,A&E,>12 hours,London,RJ6,Croydon Health Services NHS Trust,1460,13195
01/05/2025,A&E,>12 hours,London,RVR,Epsom and St Helier University Hospitals NHS Trust,2090,9920
01/05/2025,A&E,>12 hours,London,RJ1,Guy's and St Thomas' NHS Foundation Trust,145,10825
01/05/2025,A&E,>12 hours,London,RQX,Homerton University Hospital NHS Foundation Trust,75,11330
01/05/2025,A&E,>12 hours,London,RYJ,Imperial College Healthcare NHS Trust,990,16375
01/05/2025,A&E,>12 hours,London,RJZ,King's College Hospital NHS Foundation Trust,2005,15470
01/05/2025,A&E,>12 hours,London,RAX,Kingston Hospital NHS Foundation Trust,900,6800
01/05/2025,A&E,>12 hours,London,RJ2,Lewisham and Greenwich NHS Trust,2045,15375
01/05/2025,A&E,>12 hours,London,R1K,London North West University Healthcare NHS Trust,2065,14250
01/05/2025,A&E,>12 hours,London,RP6,Moorfields Eye Hospital NHS Foundation Trust,0,6040
01/05/2025,A&E,>12 hours,London,RAL,Royal Free London NHS Foundation Trust,3360,26635
01/05/2025,A&E,>12 hours,London,RJ7,St George's University Hospitals NHS Foundation Trust,1260,8900
01/05/2025,A&E,>12 hours,London,RAS,The Hillingdon Hospitals NHS Foundation Trust,695,6100
01/05/2025,A&E,>12 hours,London,RRV,University College London Hospitals NHS Foundation Trust,505,14055
01/05/2025,A&E,>12 hours,London,RKE,Whittington Health NHS Trust,530,7010
01/05/2025,A&E,>12 hours,Midlands,RQ3,Birmingham Women's and Children's NHS Foundation Trust,**,**
01/05/2025,A&E,>12 hours,Midlands,RFS,Chesterfield Royal Hospital NHS Foundation Trust,370,7465
01/05/2025,A&E,>12 hours,Midlands,RLT,George Eliot Hospital NHS Trust,820,7110
01/05/2025,A&E,>12 hours,Midlands,RNQ,Kettering General Hospital NHS Foundation Trust,1135,10305
01/05/2025,A&E,>12 hours,Midlands,RNS,Northampton General Hospital NHS Trust,1665,11165
01/05/2025,A&E,>12 hours,Midlands,RX1,Nottingham University Hospitals NHS Trust,1785,19200
01/05/2025,A&E,>12 hours,Midlands,RXK,Sandwell and West Birmingham Hospitals NHS Trust,830,14090
01/05/2025,A&E,>12 hours,Midlands,RK5,Sherwood Forest Hospitals NHS Foundation Trust,240,10840
01/05/2025,A&E,>12 hours,Midlands,RJC,South Warwickshire NHS Foundation Trust,400,8575
01/05/2025,A&E,>12 hours,Midlands,RNA,The Dudley Group NHS Foundation Trust,880,10165
01/05/2025,A&E,>12 hours,Midlands,RL4,The Royal Wolverhampton NHS Trust,1215,13560
01/05/2025,A&E,>12 hours,Midlands,RXW,The Shrewsbury and Telford Hospital NHS Trust,**,**
01/05/2025,A&E,>12 hours,Midlands,RWD,United Lincolnshire Hospitals NHS Trust,1905,10745
01/05/2025,A&E,>12 hours,Midlands,RRK,University Hospitals Birmingham NHS Foundation Trust,5240,35735
01/05/2025,A&E,>12 hours,Midlands,RKB,University Hospitals Coventry and Warwickshire NHS Trust,1790,13455
01/05/2025,A&E,>12 hours,Midlands,RTG,University Hospitals of Derby and Burton NHS Foundation Trust,2655,22695
01/05/2025,A&E,>12 hours,Midlands,RWE,University Hospitals of Leicester NHS Trust,2435,24300
01/05/2025,A&E,>12 hours,Midlands,RJE,University Hospitals of North Midlands NHS Trust,2150,15175
01/05/2025,A&E,>12 hours,Midlands,RBK,Walsall Healthcare NHS Trust,405,9380
01/05/2025,A&E,>12 hours,Midlands,RWP,Worcestershire Acute Hospitals NHS Trust,2220,14110
01/05/2025,A&E,>12 hours,Midlands,RLQ,Wye Valley NHS Trust,1010,6150
01/05/2025,A&E,>12 hours,North East,RCF,Airedale NHS Foundation Trust,245,6735
01/05/2025,A&E,>12 hours,North East,RFF,Barnsley Hospital NHS Foundation Trust,185,9345
01/05/2025,A&E,>12 hours,North East,RAE,Bradford Teaching Hospitals NHS Foundation Trust,705,12835
01/05/2025,A&E,>12 hours,North East,RWY,Calderdale and Huddersfield NHS Foundation Trust,305,16295
01/05/2025,A&E,>12 hours,North East,RXP,County Durham and Darlington NHS Foundation Trust,1340,14765
01/05/2025,A&E,>12 hours,North East,RP5,Doncaster and Bassetlaw Teaching Hospitals NHS Foundation Trust,515,16205
01/05/2025,A&E,>12 hours,North East,RR7,Gateshead Health NHS Foundation Trust,30,5925
01/05/2025,A&E,>12 hours,North East,RCD,Harrogate and District NHS Foundation Trust,105,5245
01/05/2025,A&E,>12 hours,North East,RWA,Hull University Teaching Hospitals NHS Trust,1320,10350
01/05/2025,A&E,>12 hours,North East,RR8,Leeds Teaching Hospitals NHS Trust,1445,20270
01/05/2025,A&E,>12 hours,North East,RXF,Mid Yorkshire Hospitals NHS Trust,1510,17325
01/05/2025,A&E,>12 hours,North East,RNN,North Cumbria Integrated Care NHS Foundation Trust,870,9530
01/05/2025,A&E,>12 hours,North East,RVW,North Tees and Hartlepool NHS Foundation Trust,65,4895
01/05/2025,A&E,>12 hours,North East,RJL,Northern Lincolnshire and Goole NHS Foundation Trust,1595,9275
01/05/2025,A&E,>12 hours,North East,RTF,Northumbria Healthcare NHS Foundation Trust,25,9965
01/05/2025,A&E,>12 hours,North East,RCU,Sheffield Children's NHS Foundation Trust,*,5275
01/05/2025,A&E,>12 hours,North East,RHQ,Sheffield Teaching Hospitals NHS Foundation Trust,440,10305
01/05/2025,A&E,>12 hours,North East,RTR,South Tees Hospitals NHS Foundation Trust,205,7285
01/05/2025,A&E,>12 hours,North East,R0B,South Tyneside and Sunderland NHS Foundation Trust,355,13000
01/05/2025,A&E,>12 hours,North East,RTD,The Newcastle Upon Tyne Hospitals NHS Foundation Trust,240,15205
01/05/2025,A&E,>12 hours,North East,RFR,The Rotherham NHS Foundation Trust,145,9245
01/05/2025,A&E,>12 hours,North East,RCB,York and Scarborough Teaching Hospitals NHS Foundation Trust,1370,10895
01/05/2025,A&E,>12 hours,North West,RBS,Alder Hey Children's NHS Foundation Trust,10,5920
01/05/2025,A&E,>12 hours,North West,RXL,Blackpool Teaching Hospitals NHS Foundation Trust,1720,6855
01/05/2025,A&E,>12 hours,North West,RMC,Bolton NHS Foundation Trust,530,8270
01/05/2025,A&E,>12 hours,North West,RJR,Countess of Chester Hospital NHS Foundation Trust,1390,5320
01/05/2025,A&E,>12 hours,North West,RJN,East Cheshire NHS Trust,470,4555
01/05/2025,A&E,>12 hours,North West,RXR,East Lancashire Hospitals NHS Trust,1870,12845
01/05/2025,A&E,>12 hours,North West,RXN,Lancashire Teaching Hospitals NHS Foundation Trust,1710,12375
01/05/2025,A&E,>12 hours,North West,REM,Liverpool University Hospitals NHS Foundation Trust,2665,18425
01/05/2025,A&E,>12 hours,North West,REP,Liverpool Women's NHS Foundation Trust,0,1445
01/05/2025,A&E,>12 hours,North West,R0A,Manchester University NHS Foundation Trust,1430,33670
01/05/2025,A&E,>12 hours,North West,RBN,Mersey and West Lancashire Teaching Hospitals NHS Trust,2945,17990
01/05/2025,A&E,>12 hours,North West,RBT,Mid Cheshire Hospitals NHS Foundation Trust,1635,8385
01/05/2025,A&E,>12 hours,North West,RM3,Northern Care Alliance NHS Foundation Trust,3060,27425
01/05/2025,A&E,>12 hours,North West,RWJ,Stockport NHS Foundation Trust,1075,8590
01/05/2025,A&E,>12 hours,North West,RMP,Tameside and Glossop Integrated Care NHS Foundation Trust,1420,9455
01/05/2025,A&E,>12 hours,North West,RTX,University Hospitals of Morecambe Bay NHS Foundation Trust,545,9655
01/05/2025,A&E,>12 hours,North West,RWW,Warrington and Halton Teaching Hospitals NHS Foundation Trust,1580,7500
01/05/2025,A&E,>12 hours,North West,RBL,Wirral University Teaching Hospital NHS Foundation Trust,1720,7725
01/05/2025,A&E,>12 hours,North West,RRF,"Wrightington, Wigan and Leigh NHS Foundation Trust",1350,7425
01/05/2025,A&E,>12 hours,South East,RTK,Ashford and St Peter's Hospitals NHS Foundation Trust,950,7260
01/05/2025,A&E,>12 hours,South East,RXQ,Buckinghamshire Healthcare NHS Trust,770,11105
01/05/2025,A&E,>12 hours,South East,RN7,Dartford and Gravesham NHS Trust,1200,11355
01/05/2025,A&E,>12 hours,South East,RVV,East Kent Hospitals University NHS Foundation Trust,2530,12545
01/05/2025,A&E,>12 hours,South East,RXC,East Sussex Healthcare NHS Trust,685,10685
01/05/2025,A&E,>12 hours,South East,RDU,Frimley Health NHS Foundation Trust,2095,24690
01/05/2025,A&E,>12 hours,South East,RN5,Hampshire Hospitals NHS Foundation Trust,650,11190
01/05/2025,A&E,>12 hours,South East,R1F,Isle of Wight NHS Trust,590,5560
01/05/2025,A&E,>12 hours,South East,RWF,Maidstone and Tunbridge Wells NHS Trust,1260,17385
01/05/2025,A&E,>12 hours,South East,RPA,Medway NHS Foundation Trust,1055,9925
01/05/2025,A&E,>12 hours,South East,RTH,Oxford University Hospitals NHS Foundation Trust,510,14545
01/05/2025,A&E,>12 hours,South East,RHU,Portsmouth Hospitals University National Health Service Trust,1980,12490
01/05/2025,A&E,>12 hours,South East,RHW,Royal Berkshire NHS Foundation Trust,600,15215
01/05/2025,A&E,>12 hours,South East,RA2,Royal Surrey County Hospital NHS Foundation Trust,390,7550
01/05/2025,A&E,>12 hours,South East,RTP,Surrey and Sussex Healthcare NHS Trust,1315,10440
01/05/2025,A&E,>12 hours,South East,RHM,University Hospital Southampton NHS Foundation Trust,360,13880
01/05/2025,A&E,>12 hours,South East,RYR,University Hospitals Sussex NHS Foundation Trust,1995,23115
01/05/2025,A&E,>12 hours,South West,RBD,Dorset County Hospital NHS Foundation Trust,320,5095
01/05/2025,A&E,>12 hours,South West,RTE,Gloucestershire Hospitals NHS Foundation Trust,1365,14095
01/05/2025,A&E,>12 hours,South West,RN3,Great Western Hospitals NHS Foundation Trust,960,5505
01/05/2025,A&E,>12 hours,South West,RVJ,North Bristol NHS Trust,880,9410
01/05/2025,A&E,>12 hours,South West,REF,Royal Cornwall Hospitals NHS Trust,1005,7245
01/05/2025,A&E,>12 hours,South West,RH8,Royal Devon University Healthcare NHS Foundation Trust,610,14545
01/05/2025,A&E,>12 hours,South West,RD1,Royal United Hospitals Bath NHS Foundation Trust,725,9240
01/05/2025,A&E,>12 hours,South West,RNZ,Salisbury NHS Foundation Trust,455,5105
01/05/2025,A&E,>12 hours,South West,RH5,Somerset NHS Foundation Trust,630,13085
01/05/2025,A&E,>12 hours,South West,RA9,Torbay and South Devon NHS Foundation Trust,720,7325
01/05/2025,A&E,>12 hours,South West,RA7,University Hospitals Bristol and Weston NHS Foundation Trust,645,18365
01/05/2025,A&E,>12 hours,South West,R0D,University Hospitals Dorset NHS Foundation Trust,685,16180
01/05/2025,A&E,>12 hours,South West,RK9,University Hospitals Plymouth NHS Trust,1435,9640
01/05/2025,A&E,4 hours,East,RC9,Bedfordshire Hospitals NHS Foundation Trust,22166,28340
01/05/2025,A&E,4 hours,East,RGT,Cambridge University Hospitals NHS Foundation Trust,12682,17406
01/05/2025,A&E,4 hours,East,RWH,East And North Hertfordshire NHS Trust,15315,19852
01/05/2025,A&E,4 hours,East,RDE,East Suffolk And North Essex NHS Foundation Trust,22106,28353
01/05/2025,A&E,4 hours,East,RGP,James Paget University Hospitals NHS Foundation Trust,6114,9059
01/05/2025,A&E,4 hours,East,RAJ,Mid and South Essex NHS Foundation Trust,26691,37122
01/05/2025,A&E,4 hours,East,RD8,Milton Keynes University Hospital NHS Foundation Trust,10672,14039
01/05/2025,A&E,4 hours,East,RM1,Norfolk And Norwich University Hospitals NHS Foundation Trust,17130,21050
01/05/2025,A&E,4 hours,East,RGN,North West Anglia NHS Foundation Trust,13702,20308
01/05/2025,A&E,4 hours,East,RQW,The Princess Alexandra Hospital NHS Trust,8327,12346
01/05/2025,A&E,4 hours,East,RCX,"The Queen Elizabeth Hospital, King's Lynn, NHS Foundation Trust",4956,7959
01/05/2025,A&E,4 hours,East,RWG,West Hertfordshire Teaching Hospitals NHS Trust,14345,17134
01/05/2025,A&E,4 hours,East,RGR,West Suffolk NHS Foundation Trust,7022,8945
01/05/2025,A&E,4 hours,London,RF4,"Barking, Havering And Redbridge University Hospitals NHS Trust",29833,36314
01/05/2025,A&E,4 hours,London,R1H,Barts Health NHS Trust,32237,45889
01/05/2025,A&E,4 hours,London,RQM,Chelsea And Westminster Hospital NHS Foundation Trust,21705,27313
01/05/2025,A&E,4 hours,London,RJ6,Croydon Health Services NHS Trust,15360.75,19488.75
01/05/2025,A&E,4 hours,London,RVR,Epsom And St Helier University Hospitals NHS Trust,9330,13545
01/05/2025,A&E,4 hours,London,RJ1,Guy's And St Thomas' NHS Foundation Trust,14310,18092
01/05/2025,A&E,4 hours,London,RQX,Homerton Healthcare NHS Foundation Trust,9372,11355
01/05/2025,A&E,4 hours,London,RYJ,Imperial College Healthcare NHS Trust,25413.32,31490.52
01/05/2025,A&E,4 hours,London,RJZ,King's College Hospital NHS Foundation Trust,29077.54,36102.14
01/05/2025,A&E,4 hours,London,RAX,Kingston and Richmond NHS Foundation Trust,12054,15569
01/05/2025,A&E,4 hours,London,RJ2,Lewisham And Greenwich NHS Trust,18878.71,27168.11
01/05/2025,A&E,4 hours,London,R1K,London North West University Healthcare NHS Trust,23285,30476
01/05/2025,A&E,4 hours,London,RP6,Moorfields Eye Hospital NHS Foundation Trust,5929,6040
01/05/2025,A&E,4 hours,London,RAL,Royal Free London NHS Foundation Trust,33377,43504
01/05/2025,A&E,4 hours,London,RJ7,St George's University Hospitals NHS Foundation Trust,10373,13234
01/05/2025,A&E,4 hours,London,RAS,The Hillingdon Hospitals NHS Foundation Trust,10127,13147
01/05/2025,A&E,4 hours,London,RRV,University College London Hospitals NHS Foundation Trust,13574.07,17870.77
01/05/2025,A&E,4 hours,London,RKE,Whittington Health NHS Trust,9426.61,12085.71
01/05/2025,A&E,4 hours,Midlands,RQ3,Birmingham Women's And Children's NHS Foundation Trust,5899.707,6972.707
01/05/2025,A&E,4 hours,Midlands,RFS,Chesterfield Royal Hospital NHS Foundation Trust,15666.01,19556.01
01/05/2025,A&E,4 hours,Midlands,RLT,George Eliot Hospital NHS Trust,5589,8193
01/05/2025,A&E,4 hours,Midlands,RNQ,Kettering General Hospital NHS Foundation Trust,14893,18758
01/05/2025,A&E,4 hours,Midlands,RNS,Northampton General Hospital NHS Trust,8723,13142
01/05/2025,A&E,4 hours,Midlands,RX1,Nottingham University Hospitals NHS Trust,16853,24833
01/05/2025,A&E,4 hours,Midlands,RXK,Sandwell And West Birmingham Hospitals NHS Trust,19819,24531
01/05/2025,A&E,4 hours,Midlands,RK5,Sherwood Forest Hospitals NHS Foundation Trust,13761,17427
01/05/2025,A&E,4 hours,Midlands,RXW,The Shrewsbury And Telford Hospital NHS Trust,10233,17291
01/05/2025,A&E,4 hours,Midlands,RJC,South Warwickshire University NHS Foundation Trust,6395,8984
01/05/2025,A&E,4 hours,Midlands,RNA,The Dudley Group NHS Foundation Trust,11771,14879
01/05/2025,A&E,4 hours,Midlands,RL4,The Royal Wolverhampton NHS Trust,17608,21598
01/05/2025,A&E,4 hours,Midlands,RWD,United Lincolnshire Teaching Hospitals NHS Trust,23247,30666
01/05/2025,A&E,4 hours,Midlands,RRK,University Hospitals Birmingham NHS Foundation Trust,34621.293,49723.293
01/05/2025,A&E,4 hours,Midlands,RKB,University Hospitals Coventry And Warwickshire NHS Trust,14542,19983
01/05/2025,A&E,4 hours,Midlands,RTG,University Hospitals Of Derby And Burton NHS Foundation Trust,29819.99,38968.99
01/05/2025,A&E,4 hours,Midlands,RWE,University Hospitals Of Leicester NHS Trust,30386,39787
01/05/2025,A&E,4 hours,Midlands,RJE,University Hospitals Of North Midlands NHS Trust,17861,25505
01/05/2025,A&E,4 hours,Midlands,RBK,Walsall Healthcare NHS Trust,10905,13712
01/05/2025,A&E,4 hours,Midlands,RWP,Worcestershire Acute Hospitals NHS Trust,13347,20513
01/05/2025,A&E,4 hours,Midlands,RLQ,Wye Valley NHS Trust,4440,7355
01/05/2025,A&E,4 hours,North East,RCF,Airedale NHS Foundation Trust,4729,6929
01/05/2025,A&E,4 hours,North East,RFF,Barnsley Hospital NHS Foundation Trust,6717,9336
01/05/2025,A&E,4 hours,North East,RAE,Bradford Teaching Hospitals NHS Foundation Trust,11592,14009
01/05/2025,A&E,4 hours,North East,RWY,Calderdale And Huddersfield NHS Foundation Trust,16119,18696
01/05/2025,A&E,4 hours,North East,RXP,County Durham And Darlington NHS Foundation Trust,19894,25214
01/05/2025,A&E,4 hours,North East,RP5,Doncaster And Bassetlaw Teaching Hospitals NHS Foundation Trust,13553,18317
01/05/2025,A&E,4 hours,North East,RR7,Gateshead Health NHS Foundation Trust,7868,9964
01/05/2025,A&E,4 hours,North East,RCD,Harrogate And District NHS Foundation Trust,5256,6729
01/05/2025,A&E,4 hours,North East,RWA,Hull University Teaching Hospitals NHS Trust,14002,20966
01/05/2025,A&E,4 hours,North East,RR8,Leeds Teaching Hospitals NHS Trust,24004,31385
01/05/2025,A&E,4 hours,North East,RXF,Mid Yorkshire Teaching NHS Trust,17474,23976
01/05/2025,A&E,4 hours,North East,RNN,North Cumbria Integrated Care NHS Foundation Trust,8262,12163
01/05/2025,A&E,4 hours,North East,RVW,North Tees And Hartlepool NHS Foundation Trust,14028,16376
01/05/2025,A&E,4 hours,North East,RJL,Northern Lincolnshire And Goole NHS Foundation Trust,13890,19091
01/05/2025,A&E,4 hours,North East,RTF,Northumbria Healthcare NHS Foundation Trust,21358,23619
01/05/2025,A&E,4 hours,North East,RCU,Sheffield Children's NHS Foundation Trust,4830,5276
01/05/2025,A&E,4 hours,North East,RHQ,Sheffield Teaching Hospitals NHS Foundation Trust,14432,19463
01/05/2025,A&E,4 hours,North East,RTR,South Tees Hospitals NHS Foundation Trust,15172,19519.5
01/05/2025,A&E,4 hours,North East,R0B,South Tyneside and Sunderland NHS Foundation Trust,15028,20567
01/05/2025,A&E,4 hours,North East,RTD,The Newcastle Upon Tyne Hospitals NHS Foundation Trust,16368,20704
01/05/2025,A&E,4 hours,North East,RFR,The Rotherham NHS Foundation Trust,6345,9248
01/05/2025,A&E,4 hours,North East,RCB,York And Scarborough Teaching Hospitals NHS Foundation Trust,14908,20843.5
01/05/2025,A&E,4 hours,North West,RBS,Alder Hey Children's NHS Foundation Trust,10457.24801,11339.86482
01/05/2025,A&E,4 hours,North West,RXL,Blackpool Teaching Hospitals NHS Foundation Trust,15887,20300
01/05/2025,A&E,4 hours,North West,RMC,Bolton NHS Foundation Trust,8742,12444
01/05/2025,A&E,4 hours,North West,RJR,Countess Of Chester Hospital NHS Foundation Trust,4657,7777
01/05/2025,A&E,4 hours,North West,RJN,East Cheshire NHS Trust,2635,4626
01/05/2025,A&E,4 hours,North West,RXR,East Lancashire Hospitals NHS Trust,19881,24955
01/05/2025,A&E,4 hours,North West,RXN,Lancashire Teaching Hospitals NHS Foundation Trust,11391,16036
01/05/2025,A&E,4 hours,North West,REM,Liverpool University Hospitals NHS Foundation Trust,24126.44822,32255.86673
01/05/2025,A&E,4 hours,North West,REP,Liverpool Women's NHS Foundation Trust,1251,1446
01/05/2025,A&E,4 hours,North West,R0A,Manchester University NHS Foundation Trust,32960,46155
01/05/2025,A&E,4 hours,North West,RBT,Mid Cheshire Hospitals NHS Foundation Trust,6118,10634
01/05/2025,A&E,4 hours,North West,RM3,Northern Care Alliance NHS Foundation Trust,25289,36533
01/05/2025,A&E,4 hours,North West,RBN,Mersey and West Lancashire Teaching Hospitals NHS Trust,25564.80377,32147.26845
01/05/2025,A&E,4 hours,North West,RWJ,Stockport NHS Foundation Trust,7138,10910
01/05/2025,A&E,4 hours,North West,RMP,Tameside And Glossop Integrated Care NHS Foundation Trust,7495,12171
01/05/2025,A&E,4 hours,North West,RTX,University Hospitals Of Morecambe Bay NHS Foundation Trust,10902,14462
01/05/2025,A&E,4 hours,North West,RWW,Warrington And Halton Teaching  Hospitals NHS Foundation Trust,8589.5,12459
01/05/2025,A&E,4 hours,North West,RBL,Wirral University Teaching Hospital NHS Foundation Trust,12793,17171
01/05/2025,A&E,4 hours,North West,RRF,"Wrightington, Wigan And Leigh NHS Foundation Trust",9240,12795
01/05/2025,A&E,4 hours,South East,RTK,Ashford And St Peter's Hospitals NHS Foundation Trust,11842,15610
01/05/2025,A&E,4 hours,South East,RXQ,Buckinghamshire Healthcare NHS Trust,11742,15140
01/05/2025,A&E,4 hours,South East,RN7,Dartford And Gravesham NHS Trust,11190,15668
01/05/2025,A&E,4 hours,South East,RVV,East Kent Hospitals University NHS Foundation Trust,32926.15093,38993.11146
01/05/2025,A&E,4 hours,South East,RXC,East Sussex Healthcare NHS Trust,12720,15769
01/05/2025,A&E,4 hours,South East,RDU,Frimley Health NHS Foundation Trust,26498,36462
01/05/2025,A&E,4 hours,South East,RN5,Hampshire Hospitals NHS Foundation Trust,9713,14796
01/05/2025,A&E,4 hours,South East,R1F,Isle Of Wight NHS Trust,4650,6367
01/05/2025,A&E,4 hours,South East,RWF,Maidstone And Tunbridge Wells NHS Trust,19098.01172,23190.03496
01/05/2025,A&E,4 hours,South East,RPA,Medway NHS Foundation Trust,18474.84907,22125.88854
01/05/2025,A&E,4 hours,South East,RTH,Oxford University Hospitals NHS Foundation Trust,18794.496,23916.248
01/05/2025,A&E,4 hours,South East,RHU,Portsmouth Hospitals University National Health Service Trust,21133,26235
01/05/2025,A&E,4 hours,South East,RHW,Royal Berkshire NHS Foundation Trust,16586.504,21629.752
01/05/2025,A&E,4 hours,South East,RA2,Royal Surrey County Hospital NHS Foundation Trust,7038,9409
01/05/2025,A&E,4 hours,South East,RTP,Surrey And Sussex Healthcare NHS Trust,18638.8774,22700.46946
01/05/2025,A&E,4 hours,South East,RHM,University Hospital Southampton NHS Foundation Trust,17167,22968
01/05/2025,A&E,4 hours,South East,RYR,University Hospitals Sussex NHS Foundation Trust,27968.11088,38342.49558
01/05/2025,A&E,4 hours,South West,RBD,Dorset County Hospital NHS Foundation Trust,8001,9560
01/05/2025,A&E,4 hours,South West,RTE,Gloucestershire Hospitals NHS Foundation Trust,18240,23616
01/05/2025,A&E,4 hours,South West,RN3,Great Western Hospitals NHS Foundation Trust,8895,12205.4
01/05/2025,A&E,4 hours,South West,RVJ,North Bristol NHS Trust,8805.3,12440.3
01/05/2025,A&E,4 hours,South West,RK9,University Hospitals Plymouth NHS Trust,11106,15875
01/05/2025,A&E,4 hours,South West,REF,Royal Cornwall Hospitals NHS Trust,16319,20836
01/05/2025,A&E,4 hours,South West,RH8,Royal Devon University Healthcare NHS Foundation Trust,15494,21306
01/05/2025,A&E,4 hours,South West,RD1,Royal United Hospitals Bath NHS Foundation Trust,8233,12086.6
01/05/2025,A&E,4 hours,South West,RNZ,Salisbury NHS Foundation Trust,5199,7392
01/05/2025,A&E,4 hours,South West,RH5,Somerset NHS Foundation Trust,16615,22766
01/05/2025,A&E,4 hours,South West,RA9,Torbay And South Devon NHS Foundation Trust,7873,11233
01/05/2025,A&E,4 hours,South West,R0D,University Hospitals Dorset NHS Foundation Trust,14161,20006
01/05/2025,A&E,4 hours,South West,RA7,University Hospitals Bristol and Weston NHS Foundation Trust,19020.7,25258.7
01/05/2025,Cancer,28 Days FDS,East,RC9,BEDFORDSHIRE HOSPITALS NHS FOUNDATION TRUST,1873,2476
01/05/2025,Cancer,28 Days FDS,East,RGT,CAMBRIDGE UNIVERSITY HOSPITALS NHS FOUNDATION TRUST,1968,2580
01/05/2025,Cancer,28 Days FDS,East,RWH,EAST AND NORTH HERTFORDSHIRE NHS TRUST,1174,1532
01/05/2025,Cancer,28 Days FDS,East,RDE,EAST SUFFOLK AND NORTH ESSEX NHS FOUNDATION TRUST,3208,4424
01/05/2025,Cancer,28 Days FDS,East,RGP,JAMES PAGET UNIVERSITY HOSPITALS NHS FOUNDATION TRUST,873,1149
01/05/2025,Cancer,28 Days FDS,East,RAJ,MID AND SOUTH ESSEX NHS FOUNDATION TRUST,3945,6707
01/05/2025,Cancer,28 Days FDS,East,RD8,MILTON KEYNES UNIVERSITY HOSPITAL NHS FOUNDATION TRUST,1079,1510
01/05/2025,Cancer,28 Days FDS,East,RM1,NORFOLK AND NORWICH UNIVERSITY HOSPITALS NHS FOUNDATION TRUST,2510,3526
01/05/2025,Cancer,28 Days FDS,East,RGN,NORTH WEST ANGLIA NHS FOUNDATION TRUST,1581,2016
01/05/2025,Cancer,28 Days FDS,East,RQW,THE PRINCESS ALEXANDRA HOSPITAL NHS TRUST,1205,1689
01/05/2025,Cancer,28 Days FDS,East,RCX,"THE QUEEN ELIZABETH HOSPITAL, KING'S LYNN, NHS FOUNDATION TRUST",833,1268
01/05/2025,Cancer,28 Days FDS,East,RWG,WEST HERTFORDSHIRE TEACHING HOSPITALS NHS TRUST,1590,1892
01/05/2025,Cancer,28 Days FDS,East,RGR,WEST SUFFOLK NHS FOUNDATION TRUST,942,1465
01/05/2025,Cancer,28 Days FDS,London,RF4,"BARKING, HAVERING AND REDBRIDGE UNIVERSITY HOSPITALS NHS TRUST",2081,2682
01/05/2025,Cancer,28 Days FDS,London,R1H,BARTS HEALTH NHS TRUST,2973,3709
01/05/2025,Cancer,28 Days FDS,London,RQM,CHELSEA AND WESTMINSTER HOSPITAL NHS FOUNDATION TRUST,2021,2551
01/05/2025,Cancer,28 Days FDS,London,RJ6,CROYDON HEALTH SERVICES NHS TRUST,1236,1567
01/05/2025,Cancer,28 Days FDS,London,RVR,EPSOM AND ST HELIER UNIVERSITY HOSPITALS NHS TRUST,535,721
01/05/2025,Cancer,28 Days FDS,London,RJ1,GUY'S AND ST THOMAS' NHS FOUNDATION TRUST,2045,2597
01/05/2025,Cancer,28 Days FDS,London,RQX,HOMERTON HEALTHCARE NHS FOUNDATION TRUST,1289,1593
01/05/2025,Cancer,28 Days FDS,London,RYJ,IMPERIAL COLLEGE HEALTHCARE NHS TRUST,2366,2930
01/05/2025,Cancer,28 Days FDS,London,RJZ,KING'S COLLEGE HOSPITAL NHS FOUNDATION TRUST,2453,3304
01/05/2025,Cancer,28 Days FDS,London,RAX,KINGSTON AND RICHMOND NHS FOUNDATION TRUST,1745,2040
01/05/2025,Cancer,28 Days FDS,London,RJ2,LEWISHAM AND GREENWICH NHS TRUST,2451,3235
01/05/2025,Cancer,28 Days FDS,London,R1K,LONDON NORTH WEST UNIVERSITY HEALTHCARE NHS TRUST,2349,3196
01/05/2025,Cancer,28 Days FDS,London,RAL,ROYAL FREE LONDON NHS FOUNDATION TRUST,4174,5613
01/05/2025,Cancer,28 Days FDS,London,RJ7,ST GEORGE'S UNIVERSITY HOSPITALS NHS FOUNDATION TRUST,1490,1859
01/05/2025,Cancer,28 Days FDS,London,RAS,THE HILLINGDON HOSPITALS NHS FOUNDATION TRUST,880,1288
01/05/2025,Cancer,28 Days FDS,London,RRV,UNIVERSITY COLLEGE LONDON HOSPITALS NHS FOUNDATION TRUST,1509,1937
01/05/2025,Cancer,28 Days FDS,London,RKE,WHITTINGTON HEALTH NHS TRUST,688,852
01/05/2025,Cancer,28 Days FDS,Midlands,RFS,CHESTERFIELD ROYAL HOSPITAL NHS FOUNDATION TRUST,948,1289
01/05/2025,Cancer,28 Days FDS,Midlands,RLT,GEORGE ELIOT HOSPITAL NHS TRUST,412,617
01/05/2025,Cancer,28 Days FDS,Midlands,RNQ,KETTERING GENERAL HOSPITAL NHS FOUNDATION TRUST,1030,1256
01/05/2025,Cancer,28 Days FDS,Midlands,RNS,NORTHAMPTON GENERAL HOSPITAL NHS TRUST,1528,1914
01/05/2025,Cancer,28 Days FDS,Midlands,RX1,NOTTINGHAM UNIVERSITY HOSPITALS NHS TRUST,2225,2867
01/05/2025,Cancer,28 Days FDS,Midlands,RXK,SANDWELL AND WEST BIRMINGHAM HOSPITALS NHS TRUST,1142,1661
01/05/2025,Cancer,28 Days FDS,Midlands,RK5,SHERWOOD FOREST HOSPITALS NHS FOUNDATION TRUST,1214,1588
01/05/2025,Cancer,28 Days FDS,Midlands,RJC,SOUTH WARWICKSHIRE UNIVERSITY NHS FOUNDATION TRUST,1149,1500
01/05/2025,Cancer,28 Days FDS,Midlands,RNA,THE DUDLEY GROUP NHS FOUNDATION TRUST,1292,1662
01/05/2025,Cancer,28 Days FDS,Midlands,RL4,THE ROYAL WOLVERHAMPTON NHS TRUST,1550,1934
