Date,Domain,Metric,Region,Provider Code,Provider Name,Numerator,Denominator
01/06/2025,RTT,52+ Weeks,East,RM1,NORFOLK AND NORWICH UNIVERSITY HOSPITALS NHS FOUNDATION TRUST,3643,80826
01/06/2025,RTT,52+ Weeks,East,RQW,THE PRINCESS ALEXANDRA HOSPITAL NHS TRUST,2265,48443
01/06/2025,RTT,52+ Weeks,East,RWG,WEST HERTFORDSHIRE TEACHING HOSPITALS NHS TRUST,859,46914
01/06/2025,RTT,52+ Weeks,East,RWH,EAST AND NORTH HERTFORDSHIRE NHS TRUST,911,52513
01/06/2025,RTT,52+ Weeks,London,R1H,BARTS HEALTH NHS TRUST,4894,134686
01/06/2025,RTT,52+ Weeks,London,R1K,LONDON NORTH WEST UNIVERSITY HEALTHCARE NHS TRUST,2357,86363
01/06/2025,RTT,52+ Weeks,London,RAL,ROYAL FREE LONDON NHS FOUNDATION TRUST,3982,146110
01/06/2025,RTT,52+ Weeks,London,RAN,ROYAL NATIONAL ORTHOPAEDIC HOSPITAL NHS TRUST,70,8668
01/06/2025,RTT,52+ Weeks,London,RAS,THE HILLINGDON HOSPITALS NHS FOUNDATION TRUST,437,31200
01/06/2025,RTT,52+ Weeks,London,RAX,KINGSTON AND RICHMOND NHS FOUNDATION TRUST,273,41698
01/06/2025,RTT,52+ Weeks,London,RF4,"BARKING, HAVERING AND REDBRIDGE UNIVERSITY HOSPITALS NHS TRUST",519,56931
01/06/2025,RTT,52+ Weeks,London,RJ1,GUY'S AND ST THOMAS' NHS FOUNDATION TRUST,2714,118688
01/06/2025,RTT,52+ Weeks,London,RJ2,LEWISHAM AND GREENWICH NHS TRUST,2145,53026
01/06/2025,RTT,52+ Weeks,London,RJ6,CROYDON HEALTH SERVICES NHS TRUST,900,36632
01/06/2025,RTT,52+ Weeks,London,RJ7,ST GEORGE'S UNIVERSITY HOSPITALS NHS FOUNDATION TRUST,1711,71047
01/06/2025,RTT,52+ Weeks,London,RJZ,KING'S COLLEGE HOSPITAL NHS FOUNDATION TRUST,1714,84437
01/06/2025,RTT,52+ Weeks,London,RKE,WHITTINGTON HEALTH NHS TRUST,348,25317
01/06/2025,RTT,52+ Weeks,London,RP4,GREAT ORMOND STREET HOSPITAL FOR CHILDREN NHS FOUNDATION TRUST,232,8092
01/06/2025,RTT,52+ Weeks,London,RP6,MOORFIELDS EYE HOSPITAL NHS FOUNDATION TRUST,19,34491
01/06/2025,RTT,52+ Weeks,London,RQM,CHELSEA AND WESTMINSTER HOSPITAL NHS FOUNDATION TRUST,1038,70301
01/06/2025,RTT,52+ Weeks,London,RQX,HOMERTON HEALTHCARE NHS FOUNDATION TRUST,341,36119
01/06/2025,RTT,52+ Weeks,London,RRV,UNIVERSITY COLLEGE LONDON HOSPITALS NHS FOUNDATION TRUST,1278,72181
01/06/2025,RTT,52+ Weeks,London,RVR,EPSOM AND ST HELIER UNIVERSITY HOSPITALS NHS TRUST,991,56109
01/06/2025,RTT,52+ Weeks,London,RYJ,IMPERIAL COLLEGE HEALTHCARE NHS TRUST,1644,88971
01/06/2025,RTT,52+ Weeks,Midlands,RBK,WALSALL HEALTHCARE NHS TRUST,44,28037
01/06/2025,RTT,52+ Weeks,Midlands,RFS,CHESTERFIELD ROYAL HOSPITAL NHS FOUNDATION TRUST,923,31524
01/06/2025,RTT,52+ Weeks,Midlands,RJC,SOUTH WARWICKSHIRE UNIVERSITY NHS FOUNDATION TRUST,745,33389
01/06/2025,RTT,52+ Weeks,Midlands,RJE,UNIVERSITY HOSPITALS OF NORTH MIDLANDS NHS TRUST,1651,64546
01/06/2025,RTT,52+ Weeks,Midlands,RK5,SHERWOOD FOREST HOSPITALS NHS FOUNDATION TRUST,395,35440
01/06/2025,RTT,52+ Weeks,Midlands,RKB,UNIVERSITY HOSPITALS COVENTRY AND WARWICKSHIRE NHS TRUST,1963,76987
01/06/2025,RTT,52+ Weeks,Midlands,RL1,THE ROBERT JONES AND AGNES HUNT ORTHOPAEDIC HOSPITAL NHS FOUNDATION TRUST,1343,17324
01/06/2025,RTT,52+ Weeks,Midlands,RL4,THE ROYAL WOLVERHAMPTON NHS TRUST,2376,79749
01/06/2025,RTT,52+ Weeks,Midlands,RLQ,WYE VALLEY NHS TRUST,723,22842
01/06/2025,RTT,52+ Weeks,Midlands,RLT,GEORGE ELIOT HOSPITAL NHS TRUST,687,20279
01/06/2025,RTT,52+ Weeks,Midlands,RNA,THE DUDLEY GROUP NHS FOUNDATION TRUST,454,46663
01/06/2025,RTT,52+ Weeks,Midlands,RNQ,KETTERING GENERAL HOSPITAL NHS FOUNDATION TRUST,246,24955
01/06/2025,RTT,52+ Weeks,Midlands,RNS,NORTHAMPTON GENERAL HOSPITAL NHS TRUST,547,42422
01/06/2025,RTT,52+ Weeks,Midlands,RQ3,BIRMINGHAM WOMEN'S AND CHILDREN'S NHS FOUNDATION TRUST,238,28273
01/06/2025,RTT,52+ Weeks,Midlands,RRJ,THE ROYAL ORTHOPAEDIC HOSPITAL NHS FOUNDATION TRUST,466,12954
01/06/2025,RTT,52+ Weeks,Midlands,RRK,UNIVERSITY HOSPITALS BIRMINGHAM NHS FOUNDATION TRUST,5369,104142
01/06/2025,RTT,52+ Weeks,Midlands,RTG,UNIVERSITY HOSPITALS OF DERBY AND BURTON NHS FOUNDATION TRUST,2190,100955
01/06/2025,RTT,52+ Weeks,Midlands,RWD,UNITED LINCOLNSHIRE TEACHING HOSPITALS NHS TRUST,1805,70363
01/06/2025,RTT,52+ Weeks,Midlands,RWE,UNIVERSITY HOSPITALS OF LEICESTER NHS TRUST,2605,109577
01/06/2025,RTT,52+ Weeks,Midlands,RWP,WORCESTERSHIRE ACUTE HOSPITALS NHS TRUST,952,55488
01/06/2025,RTT,52+ Weeks,Midlands,RX1,NOTTINGHAM UNIVERSITY HOSPITALS NHS TRUST,1641,81613
01/06/2025,RTT,52+ Weeks,Midlands,RXK,SANDWELL AND WEST BIRMINGHAM HOSPITALS NHS TRUST,1131,65540
01/06/2025,RTT,52+ Weeks,Midlands,RXW,THE SHREWSBURY AND TELFORD HOSPITAL NHS TRUST,718,37630
01/06/2025,RTT,52+ Weeks,North East,R0B,SOUTH TYNESIDE AND SUNDERLAND NHS FOUNDATION TRUST,18,58022
01/06/2025,RTT,52+ Weeks,North East,RAE,BRADFORD TEACHING HOSPITALS NHS FOUNDATION TRUST,190,32915
01/06/2025,RTT,52+ Weeks,North East,RCB,YORK AND SCARBOROUGH TEACHING HOSPITALS NHS FOUNDATION TRUST,1548,53156
01/06/2025,RTT,52+ Weeks,North East,RCD,HARROGATE AND DISTRICT NHS FOUNDATION TRUST,4,19927
01/06/2025,RTT,52+ Weeks,North East,RCF,AIREDALE NHS FOUNDATION TRUST,59,13846
01/06/2025,RTT,52+ Weeks,North East,RCU,SHEFFIELD CHILDREN'S NHS FOUNDATION TRUST,326,12187
01/06/2025,RTT,52+ Weeks,North East,RFF,BARNSLEY HOSPITAL NHS FOUNDATION TRUST,122,25499
01/06/2025,RTT,52+ Weeks,North East,RFR,THE ROTHERHAM NHS FOUNDATION TRUST,634,30954
01/06/2025,RTT,52+ Weeks,North East,RHQ,SHEFFIELD TEACHING HOSPITALS NHS FOUNDATION TRUST,1797,91256
01/06/2025,RTT,52+ Weeks,North East,RJL,NORTHERN LINCOLNSHIRE AND GOOLE NHS FOUNDATION TRUST,950,39592
01/06/2025,RTT,52+ Weeks,North East,RNN,NORTH CUMBRIA INTEGRATED CARE NHS FOUNDATION TRUST,1098,38030
01/06/2025,RTT,52+ Weeks,North East,RP5,DONCASTER AND BASSETLAW TEACHING HOSPITALS NHS FOUNDATION TRUST,1560,55406
01/06/2025,RTT,52+ Weeks,North East,RR7,GATESHEAD HEALTH NHS FOUNDATION TRUST,18,13202
01/06/2025,RTT,52+ Weeks,North East,RR8,LEEDS TEACHING HOSPITALS NHS TRUST,2742,88152
01/06/2025,RTT,52+ Weeks,North East,RTD,THE NEWCASTLE UPON TYNE HOSPITALS NHS FOUNDATION TRUST,1297,88950
01/06/2025,RTT,52+ Weeks,North East,RTF,NORTHUMBRIA HEALTHCARE NHS FOUNDATION TRUST,17,36625
01/06/2025,RTT,52+ Weeks,North East,RTR,SOUTH TEES HOSPITALS NHS FOUNDATION TRUST,1610,56521
01/06/2025,RTT,52+ Weeks,North East,RVW,NORTH TEES AND HARTLEPOOL NHS FOUNDATION TRUST,255,20870
01/06/2025,RTT,52+ Weeks,North East,RWA,HULL UNIVERSITY TEACHING HOSPITALS NHS TRUST,2702,79235
01/06/2025,RTT,52+ Weeks,North East,RWY,CALDERDALE AND HUDDERSFIELD NHS FOUNDATION TRUST,46,36565
01/06/2025,RTT,52+ Weeks,North East,RXF,MID YORKSHIRE TEACHING NHS TRUST,408,56631
01/06/2025,RTT,52+ Weeks,North East,RXP,COUNTY DURHAM AND DARLINGTON NHS FOUNDATION TRUST,377,39405
01/06/2025,RTT,52+ Weeks,North West,R0A,MANCHESTER UNIVERSITY NHS FOUNDATION TRUST,7500,186865
01/06/2025,RTT,52+ Weeks,North West,RBL,WIRRAL UNIVERSITY TEACHING HOSPITAL NHS FOUNDATION TRUST,1302,46939
01/06/2025,RTT,52+ Weeks,North West,RBN,MERSEY AND WEST LANCASHIRE TEACHING HOSPITALS NHS TRUST,1957,74425
01/06/2025,RTT,52+ Weeks,North West,RBQ,LIVERPOOL HEART AND CHEST HOSPITAL NHS FOUNDATION TRUST,49,5111
01/06/2025,RTT,52+ Weeks,North West,RBS,ALDER HEY CHILDREN'S NHS FOUNDATION TRUST,375,18292
01/06/2025,RTT,52+ Weeks,North West,RBT,MID CHESHIRE HOSPITALS NHS FOUNDATION TRUST,2034,39213
01/06/2025,RTT,52+ Weeks,North West,REM,LIVERPOOL UNIVERSITY HOSPITALS NHS FOUNDATION TRUST,2839,68055
01/06/2025,RTT,52+ Weeks,North West,REP,LIVERPOOL WOMEN'S NHS FOUNDATION TRUST,582,16290
01/06/2025,RTT,52+ Weeks,North West,RET,THE WALTON CENTRE NHS FOUNDATION TRUST,127,14248
01/06/2025,RTT,52+ Weeks,North West,RJN,EAST CHESHIRE NHS TRUST,376,14121
01/06/2025,RTT,52+ Weeks,North West,RJR,COUNTESS OF CHESTER HOSPITAL NHS FOUNDATION TRUST,2837,34246
01/06/2025,RTT,52+ Weeks,North West,RM3,NORTHERN CARE ALLIANCE NHS FOUNDATION TRUST,5037,136427
01/06/2025,RTT,52+ Weeks,North West,RMC,BOLTON NHS FOUNDATION TRUST,1154,37252
01/06/2025,RTT,52+ Weeks,North West,RMP,TAMESIDE AND GLOSSOP INTEGRATED CARE NHS FOUNDATION TRUST,0,17017
01/06/2025,RTT,52+ Weeks,North West,RRF,"WRIGHTINGTON, WIGAN AND LEIGH NHS FOUNDATION TRUST",1821,49368
01/06/2025,RTT,52+ Weeks,North West,RTX,UNIVERSITY HOSPITALS OF MORECAMBE BAY NHS FOUNDATION TRUST,560,35035
01/06/2025,RTT,52+ Weeks,North West,RWJ,STOCKPORT NHS FOUNDATION TRUST,993,34356
01/06/2025,RTT,52+ Weeks,North West,RWW,WARRINGTON AND HALTON TEACHING HOSPITALS NHS FOUNDATION TRUST,1635,32542
01/06/2025,RTT,52+ Weeks,North West,RXL,BLACKPOOL TEACHING HOSPITALS NHS FOUNDATION TRUST,1730,37267
01/06/2025,RTT,52+ Weeks,North West,RXN,LANCASHIRE TEACHING HOSPITALS NHS FOUNDATION TRUST,2068,63253
01/06/2025,RTT,52+ Weeks,North West,RXR,EAST LANCASHIRE HOSPITALS NHS TRUST,2210,58187
01/06/2025,RTT,52+ Weeks,South East,R1F,ISLE OF WIGHT NHS TRUST,59,13948
01/06/2025,RTT,52+ Weeks,South East,RA2,ROYAL SURREY COUNTY HOSPITAL NHS FOUNDATION TRUST,1521,30202
01/06/2025,RTT,52+ Weeks,South East,RDU,FRIMLEY HEALTH NHS FOUNDATION TRUST,2657,74184
01/06/2025,RTT,52+ Weeks,South East,RHM,UNIVERSITY HOSPITAL SOUTHAMPTON NHS FOUNDATION TRUST,1423,62639
01/06/2025,RTT,52+ Weeks,South East,RHU,PORTSMOUTH HOSPITALS UNIVERSITY NHS TRUST,2336,59029
01/06/2025,RTT,52+ Weeks,South East,RHW,ROYAL BERKSHIRE NHS FOUNDATION TRUST,32,36524
01/06/2025,RTT,52+ Weeks,South East,RN5,HAMPSHIRE HOSPITALS NHS FOUNDATION TRUST,1661,50346
01/06/2025,RTT,52+ Weeks,South East,RN7,DARTFORD AND GRAVESHAM NHS TRUST,957,32577
01/06/2025,RTT,52+ Weeks,South East,RPA,MEDWAY NHS FOUNDATION TRUST,1735,39993
01/06/2025,RTT,52+ Weeks,South East,RPC,QUEEN VICTORIA HOSPITAL NHS FOUNDATION TRUST,388,17869
01/06/2025,RTT,52+ Weeks,South East,RTH,OXFORD UNIVERSITY HOSPITALS NHS FOUNDATION TRUST,2847,86825
01/06/2025,RTT,52+ Weeks,South East,RTK,ASHFORD AND ST PETER'S HOSPITALS NHS FOUNDATION TRUST,863,55342
01/06/2025,RTT,52+ Weeks,South East,RTP,SURREY AND SUSSEX HEALTHCARE NHS TRUST,958,52412
01/06/2025,RTT,52+ Weeks,South East,RVV,EAST KENT HOSPITALS UNIVERSITY NHS FOUNDATION TRUST,2222,80689
01/06/2025,RTT,52+ Weeks,South East,RWF,MAIDSTONE AND TUNBRIDGE WELLS NHS TRUST,0,47980
01/06/2025,RTT,52+ Weeks,South East,RXC,EAST SUSSEX HEALTHCARE NHS TRUST,864,61539
01/06/2025,RTT,52+ Weeks,South East,RXQ,BUCKINGHAMSHIRE HEALTHCARE NHS TRUST,1241,49406
01/06/2025,RTT,52+ Weeks,South East,RYR,UNIVERSITY HOSPITALS SUSSEX NHS FOUNDATION TRUST,5860,113122
01/06/2025,RTT,52+ Weeks,South West,R0D,UNIVERSITY HOSPITALS DORSET NHS FOUNDATION TRUST,2097,62683
01/06/2025,RTT,52+ Weeks,South West,RA7,UNIVERSITY HOSPITALS BRISTOL AND WESTON NHS FOUNDATION TRUST,759,55123
01/06/2025,RTT,52+ Weeks,South West,RA9,TORBAY AND SOUTH DEVON NHS FOUNDATION TRUST,677,33261
01/06/2025,RTT,52+ Weeks,South West,RBD,DORSET COUNTY HOSPITAL NHS FOUNDATION TRUST,377,22411
01/06/2025,RTT,52+ Weeks,South West,RD1,ROYAL UNITED HOSPITALS BATH NHS FOUNDATION TRUST,1016,41848
01/06/2025,RTT,52+ Weeks,South West,REF,ROYAL CORNWALL HOSPITALS NHS TRUST,409,40614
01/06/2025,RTT,52+ Weeks,South West,RH5,SOMERSET NHS FOUNDATION TRUST,1587,57390
01/06/2025,RTT,52+ Weeks,South West,RH8,ROYAL DEVON UNIVERSITY HEALTHCARE NHS FOUNDATION TRUST,2309,73740
01/06/2025,RTT,52+ Weeks,South West,RK9,UNIVERSITY HOSPITALS PLYMOUTH NHS TRUST,1720,48276
01/06/2025,RTT,52+ Weeks,South West,RN3,GREAT WESTERN HOSPITALS NHS FOUNDATION TRUST,679,38213
01/06/2025,RTT,52+ Weeks,South West,RNZ,SALISBURY NHS FOUNDATION TRUST,224,29121
01/06/2025,RTT,52+ Weeks,South West,RTE,GLOUCESTERSHIRE HOSPITALS NHS FOUNDATION TRUST,46,60281
01/06/2025,RTT,52+ Weeks,South West,RVJ,NORTH BRISTOL NHS TRUST,156,43915
01/07/2025,A&E,>12 hours,East,RC9,Bedfordshire Hospitals NHS Foundation Trust,530,17505
01/07/2025,A&E,>12 hours,East,RGT,Cambridge University Hospitals NHS Foundation Trust,1120,11305
01/07/2025,A&E,>12 hours,East,RWH,East and North Hertfordshire NHS Trust,**,**
01/07/2025,A&E,>12 hours,East,RDE,East Suffolk and North Essex NHS Foundation Trust,1490,14755
01/07/2025,A&E,>12 hours,East,RGP,James Paget University Hospitals NHS Foundation Trust,470,7970
01/07/2025,A&E,>12 hours,East,RAJ,Mid and South Essex NHS Foundation Trust,2315,35505
01/07/2025,A&E,>12 hours,East,RD8,Milton Keynes University Hospital NHS Foundation Trust,345,9230
01/07/2025,A&E,>12 hours,East,RM1,Norfolk and Norwich University Hospitals NHS Foundation Trust,525,13270
01/07/2025,A&E,>12 hours,East,RGN,North West Anglia NHS Foundation Trust,1555,16070
01/07/2025,A&E,>12 hours,East,RQW,The Princess Alexandra Hospital NHS Trust,875,10470
01/07/2025,A&E,>12 hours,East,RCX,"The Queen Elizabeth Hospital, King's Lynn, NHS Foundation Trust",1120,7030
01/07/2025,A&E,>12 hours,East,RWG,West Hertfordshire Hospitals Teaching NHS Trust,495,8425
01/07/2025,A&E,>12 hours,East,RGR,West Suffolk NHS Foundation Trust,355,8435
01/07/2025,A&E,>12 hours,London,RF4,"Barking, Havering and Redbridge University Hospitals NHS Trust",2135,15725
01/07/2025,A&E,>12 hours,London,R1H,Barts Health NHS Trust,3255,26325
01/07/2025,A&E,>12 hours,London,RQM,Chelsea and Westminster Hospital NHS Foundation Trust,525,12185
01/07/2025,A&E,>12 hours,London,RJ6,Croydon Health Services NHS Trust,1540,13155
01/07/2025,A&E,>12 hours,London,RVR,Epsom and St Helier University Hospitals NHS Trust,1710,11290
01/07/2025,A&E,>12 hours,London,RJ1,Guy's and St Thomas' NHS Foundation Trust,160,10700
01/07/2025,A&E,>12 hours,London,RQX,Homerton University Hospital NHS Foundation Trust,60,11440
01/07/2025,A&E,>12 hours,London,RYJ,Imperial College Healthcare NHS Trust,1160,16825
01/07/2025,A&E,>12 hours,London,RJZ,King's College Hospital NHS Foundation Trust,1745,15850
01/07/2025,A&E,>12 hours,London,RAX,Kingston Hospital NHS Foundation Trust,1055,6890
01/07/2025,A&E,>12 hours,London,RJ2,Lewisham and Greenwich NHS Trust,1810,15420
01/07/2025,A&E,>12 hours,London,R1K,London North West University Healthcare NHS Trust,1445,13935
01/07/2025,A&E,>12 hours,London,RP6,Moorfields Eye Hospital NHS Foundation Trust,0,6120
01/07/2025,A&E,>12 hours,London,RAL,Royal Free London NHS Foundation Trust,3225,27290
01/07/2025,A&E,>12 hours,London,RJ7,St George's University Hospitals NHS Foundation Trust,1010,9080
01/07/2025,A&E,>12 hours,London,RAS,The Hillingdon Hospitals NHS Foundation Trust,560,5925
01/07/2025,A&E,>12 hours,London,RRV,University College London Hospitals NHS Foundation Trust,250,14180
01/07/2025,A&E,>12 hours,London,RKE,Whittington Health NHS Trust,535,6965
01/07/2025,A&E,>12 hours,Midlands,RQ3,Birmingham Women's and Children's NHS Foundation Trust,**,**
01/07/2025,A&E,>12 hours,Midlands,RFS,Chesterfield Royal Hospital NHS Foundation Trust,285,7535
01/07/2025,A&E,>12 hours,Midlands,RLT,George Eliot Hospital NHS Trust,760,6845
01/07/2025,A&E,>12 hours,Midlands,RNQ,Kettering General Hospital NHS Foundation Trust,1250,10480
01/07/2025,A&E,>12 hours,Midlands,RNS,Northampton General Hospital NHS Trust,1830,13005
01/07/2025,A&E,>12 hours,Midlands,RX1,Nottingham University Hospitals NHS Trust,1925,19050
01/07/2025,A&E,>12 hours,Midlands,RXK,Sandwell and West Birmingham Hospitals NHS Trust,555,14505
01/07/2025,A&E,>12 hours,Midlands,RK5,Sherwood Forest Hospitals NHS Foundation Trust,325,11140
01/07/2025,A&E,>12 hours,Midlands,RJC,South Warwickshire NHS Foundation Trust,190,8490
01/07/2025,A&E,>12 hours,Midlands,RNA,The Dudley Group NHS Foundation Trust,935,10390
01/07/2025,A&E,>12 hours,Midlands,RL4,The Royal Wolverhampton NHS Trust,1315,13890
01/07/2025,A&E,>12 hours,Midlands,RXW,The Shrewsbury and Telford Hospital NHS Trust,2450,11425
01/07/2025,A&E,>12 hours,Midlands,RWD,United Lincolnshire Hospitals NHS Trust,2060,10915
01/07/2025,A&E,>12 hours,Midlands,RRK,University Hospitals Birmingham NHS Foundation Trust,4450,36065
01/07/2025,A&E,>12 hours,Midlands,RKB,University Hospitals Coventry and Warwickshire NHS Trust,1360,14090
01/07/2025,A&E,>12 hours,Midlands,RTG,University Hospitals of Derby and Burton NHS Foundation Trust,2565,23830
01/07/2025,A&E,>12 hours,Midlands,RWE,University Hospitals of Leicester NHS Trust,2070,23030
01/07/2025,A&E,>12 hours,Midlands,RJE,University Hospitals of North Midlands NHS Trust,1575,15745
01/07/2025,A&E,>12 hours,Midlands,RBK,Walsall Healthcare NHS Trust,485,9865
01/07/2025,A&E,>12 hours,Midlands,RWP,Worcestershire Acute Hospitals NHS Trust,1845,14395
01/07/2025,A&E,>12 hours,Midlands,RLQ,Wye Valley NHS Trust,555,6315
01/07/2025,A&E,>12 hours,North East,RCF,Airedale NHS Foundation Trust,225,6950
01/07/2025,A&E,>12 hours,North East,RFF,Barnsley Hospital NHS Foundation Trust,90,9375
01/07/2025,A&E,>12 hours,North East,RAE,Bradford Teaching Hospitals NHS Foundation Trust,545,9600
01/07/2025,A&E,>12 hours,North East,RWY,Calderdale and Huddersfield NHS Foundation Trust,240,16770
01/07/2025,A&E,>12 hours,North East,RXP,County Durham and Darlington NHS Foundation Trust,1015,14655
01/07/2025,A&E,>12 hours,North East,RP5,Doncaster and Bassetlaw Teaching Hospitals NHS Foundation Trust,420,16695
01/07/2025,A&E,>12 hours,North East,RR7,Gateshead Health NHS Foundation Trust,15,6280
01/07/2025,A&E,>12 hours,North East,RCD,Harrogate and District NHS Foundation Trust,30,5440
01/07/2025,A&E,>12 hours,North East,RWA,Hull University Teaching Hospitals NHS Trust,1235,10665
01/07/2025,A&E,>12 hours,North East,RR8,Leeds Teaching Hospitals NHS Trust,905,19670
01/07/2025,A&E,>12 hours,North East,RXF,Mid Yorkshire Hospitals NHS Trust,860,17290
01/07/2025,A&E,>12 hours,North East,RNN,North Cumbria Integrated Care NHS Foundation Trust,855,9405
01/07/2025,A&E,>12 hours,North East,RVW,North Tees and Hartlepool NHS Foundation Trust,75,4945
01/07/2025,A&E,>12 hours,North East,RJL,Northern Lincolnshire and Goole NHS Foundation Trust,1300,9490
01/07/2025,A&E,>12 hours,North East,RTF,Northumbria Healthcare NHS Foundation Trust,15,10410
01/07/2025,A&E,>12 hours,North East,RCU,Sheffield Children's NHS Foundation Trust,0,5070
01/07/2025,A&E,>12 hours,North East,RHQ,Sheffield Teaching Hospitals NHS Foundation Trust,820,12070
01/07/2025,A&E,>12 hours,North East,RTR,South Tees Hospitals NHS Foundation Trust,205,7415
01/07/2025,A&E,>12 hours,North East,R0B,South Tyneside and Sunderland NHS Foundation Trust,**,**
01/07/2025,A&E,>12 hours,North East,RTD,The Newcastle Upon Tyne Hospitals NHS Foundation Trust,250,15355
01/07/2025,A&E,>12 hours,North East,RFR,The Rotherham NHS Foundation Trust,125,9265
01/07/2025,A&E,>12 hours,North East,RCB,York and Scarborough Teaching Hospitals NHS Foundation Trust,1425,11110
01/07/2025,A&E,>12 hours,North West,RBS,Alder Hey Children's NHS Foundation Trust,*,5410
01/07/2025,A&E,>12 hours,North West,RXL,Blackpool Teaching Hospitals NHS Foundation Trust,1665,7105
01/07/2025,A&E,>12 hours,North West,RMC,Bolton NHS Foundation Trust,780,8220
01/07/2025,A&E,>12 hours,North West,RJR,Countess of Chester Hospital NHS Foundation Trust,1150,5495
01/07/2025,A&E,>12 hours,North West,RJN,East Cheshire NHS Trust,**,**
01/07/2025,A&E,>12 hours,North West,RXR,East Lancashire Hospitals NHS Trust,2075,14255
01/07/2025,A&E,>12 hours,North West,RXN,Lancashire Teaching Hospitals NHS Foundation Trust,1545,12530
01/07/2025,A&E,>12 hours,North West,REM,Liverpool University Hospitals NHS Foundation Trust,2810,18660
01/07/2025,A&E,>12 hours,North West,REP,Liverpool Women's NHS Foundation Trust,0,1570
01/07/2025,A&E,>12 hours,North West,R0A,Manchester University NHS Foundation Trust,1105,34320
01/07/2025,A&E,>12 hours,North West,RBN,Mersey and West Lancashire Teaching Hospitals NHS Trust,3150,18570
01/07/2025,A&E,>12 hours,North West,RBT,Mid Cheshire Hospitals NHS Foundation Trust,1755,8145
01/07/2025,A&E,>12 hours,North West,RM3,Northern Care Alliance NHS Foundation Trust,2825,27995
01/07/2025,A&E,>12 hours,North West,RWJ,Stockport NHS Foundation Trust,910,8660
01/07/2025,A&E,>12 hours,North West,RMP,Tameside and Glossop Integrated Care NHS Foundation Trust,1060,9415
01/07/2025,A&E,>12 hours,North West,RTX,University Hospitals of Morecambe Bay NHS Foundation Trust,575,9865
01/07/2025,A&E,>12 hours,North West,RWW,Warrington and Halton Teaching Hospitals NHS Foundation Trust,1580,7635
01/07/2025,A&E,>12 hours,North West,RBL,Wirral University Teaching Hospital NHS Foundation Trust,1730,8045
01/07/2025,A&E,>12 hours,North West,RRF,"Wrightington, Wigan and Leigh NHS Foundation Trust",1295,7415
01/07/2025,A&E,>12 hours,South East,RTK,Ashford and St Peter's Hospitals NHS Foundation Trust,900,7460
01/07/2025,A&E,>12 hours,South East,RXQ,Buckinghamshire Healthcare NHS Trust,835,11380
01/07/2025,A&E,>12 hours,South East,RN7,Dartford and Gravesham NHS Trust,760,11340
01/07/2025,A&E,>12 hours,South East,RVV,East Kent Hospitals University NHS Foundation Trust,2625,12845
01/07/2025,A&E,>12 hours,South East,RXC,East Sussex Healthcare NHS Trust,740,10965
01/07/2025,A&E,>12 hours,South East,RDU,Frimley Health NHS Foundation Trust,1825,25055
01/07/2025,A&E,>12 hours,South East,RN5,Hampshire Hospitals NHS Foundation Trust,310,11045
01/07/2025,A&E,>12 hours,South East,R1F,Isle of Wight NHS Trust,530,5855
01/07/2025,A&E,>12 hours,South East,RWF,Maidstone and Tunbridge Wells NHS Trust,1060,17230
01/07/2025,A&E,>12 hours,South East,RPA,Medway NHS Foundation Trust,1175,10250
01/07/2025,A&E,>12 hours,South East,RTH,Oxford University Hospitals NHS Foundation Trust,100,14265
01/07/2025,A&E,>12 hours,South East,RHU,Portsmouth Hospitals University National Health Service Trust,1640,13590
01/07/2025,A&E,>12 hours,South East,RHW,Royal Berkshire NHS Foundation Trust,375,15865
01/07/2025,A&E,>12 hours,South East,RA2,Royal Surrey County Hospital NHS Foundation Trust,430,7540
01/07/2025,A&E,>12 hours,South East,RTP,Surrey and Sussex Healthcare NHS Trust,1355,10625
01/07/2025,A&E,>12 hours,South East,RHM,University Hospital Southampton NHS Foundation Trust,295,13825
01/07/2025,A&E,>12 hours,South East,RYR,University Hospitals Sussex NHS Foundation Trust,1500,23405
01/07/2025,A&E,>12 hours,South West,RBD,Dorset County Hospital NHS Foundation Trust,420,5645
01/07/2025,A&E,>12 hours,South West,RTE,Gloucestershire Hospitals NHS Foundation Trust,1405,14145
01/07/2025,A&E,>12 hours,South West,RN3,Great Western Hospitals NHS Foundation Trust,650,5850
01/07/2025,A&E,>12 hours,South West,RVJ,North Bristol NHS Trust,635,9430
01/07/2025,A&E,>12 hours,South West,REF,Royal Cornwall Hospitals NHS Trust,495,7305
01/07/2025,A&E,>12 hours,South West,RH8,Royal Devon University Healthcare NHS Foundation Trust,575,14870
01/07/2025,A&E,>12 hours,South West,RD1,Royal United Hospitals Bath NHS Foundation Trust,610,8845
01/07/2025,A&E,>12 hours,South West,RNZ,Salisbury NHS Foundation Trust,240,5075
01/07/2025,A&E,>12 hours,South West,RH5,Somerset NHS Foundation Trust,255,13100
01/07/2025,A&E,>12 hours,South West,RA9,Torbay and South Devon NHS Foundation Trust,485,7515
01/07/2025,A&E,>12 hours,South West,RA7,University Hospitals Bristol and Weston NHS Foundation Trust,405,18355
01/07/2025,A&E,>12 hours,South West,R0D,University Hospitals Dorset NHS Foundation Trust,625,16875
01/07/2025,A&E,>12 hours,South West,RK9,University Hospitals Plymouth NHS Trust,985,9800
01/07/2025,A&E,4 hours,East,RC9,Bedfordshire Hospitals NHS Foundation Trust,21526,28636
01/07/2025,A&E,4 hours,East,RGT,Cambridge University Hospitals NHS Foundation Trust,13097,17662
01/07/2025,A&E,4 hours,East,RWH,East And North Hertfordshire NHS Trust,15630,19690
01/07/2025,A&E,4 hours,East,RDE,East Suffolk And North Essex NHS Foundation Trust,20622,27279
01/07/2025,A&E,4 hours,East,RGP,James Paget University Hospitals NHS Foundation Trust,6546,9457
01/07/2025,A&E,4 hours,East,RAJ,Mid and South Essex NHS Foundation Trust,29174,37596
01/07/2025,A&E,4 hours,East,RD8,Milton Keynes University Hospital NHS Foundation Trust,11322,14656
01/07/2025,A&E,4 hours,East,RM1,Norfolk And Norwich University Hospitals NHS Foundation Trust,17543,21073
01/07/2025,A&E,4 hours,East,RGN,North West Anglia NHS Foundation Trust,15648,20675
01/07/2025,A&E,4 hours,East,RQW,The Princess Alexandra Hospital NHS Trust,8975,12517
01/07/2025,A&E,4 hours,East,RCX,"The Queen Elizabeth Hospital, King's Lynn, NHS Foundation Trust",4787,8169
01/07/2025,A&E,4 hours,East,RWG,West Hertfordshire Teaching Hospitals NHS Trust,14241,16879
01/07/2025,A&E,4 hours,East,RGR,West Suffolk NHS Foundation Trust,6813,9161
01/07/2025,A&E,4 hours,London,RF4,"Barking, Havering And Redbridge University Hospitals NHS Trust",29890,36058
01/07/2025,A&E,4 hours,London,R1H,Barts Health NHS Trust,33386,45493
01/07/2025,A&E,4 hours,London,RQM,Chelsea And Westminster Hospital NHS Foundation Trust,21023,26596
01/07/2025,A&E,4 hours,London,RJ6,Croydon Health Services NHS Trust,14302.75,18872.25
01/07/2025,A&E,4 hours,London,RVR,Epsom And St Helier University Hospitals NHS Trust,9945,13398
01/07/2025,A&E,4 hours,London,RJ1,Guy's And St Thomas' NHS Foundation Trust,14023,17951
01/07/2025,A&E,4 hours,London,RQX,Homerton Healthcare NHS Foundation Trust,9281,11437
01/07/2025,A&E,4 hours,London,RYJ,Imperial College Healthcare NHS Trust,25985.4,31774
01/07/2025,A&E,4 hours,London,RJZ,King's College Hospital NHS Foundation Trust,29205.26,36576.94
01/07/2025,A&E,4 hours,London,RAX,Kingston and Richmond NHS Foundation Trust,11521,15407
01/07/2025,A&E,4 hours,London,RJ2,Lewisham And Greenwich NHS Trust,19384.99,27199.81
01/07/2025,A&E,4 hours,London,R1K,London North West University Healthcare NHS Trust,24483,31085
01/07/2025,A&E,4 hours,London,RP6,Moorfields Eye Hospital NHS Foundation Trust,5934,6123
01/07/2025,A&E,4 hours,London,RAL,Royal Free London NHS Foundation Trust,34511,43570
01/07/2025,A&E,4 hours,London,RJ7,St George's University Hospitals NHS Foundation Trust,10544,13413
01/07/2025,A&E,4 hours,London,RAS,The Hillingdon Hospitals NHS Foundation Trust,10765,13231
01/07/2025,A&E,4 hours,London,RRV,University College London Hospitals NHS Foundation Trust,14213.9,17918.75
01/07/2025,A&E,4 hours,London,RKE,Whittington Health NHS Trust,9553.7,11902.25
01/07/2025,A&E,4 hours,Midlands,RQ3,Birmingham Women's And Children's NHS Foundation Trust,5459.896,6024.896
01/07/2025,A&E,4 hours,Midlands,RFS,Chesterfield Royal Hospital NHS Foundation Trust,15089.68,19042.88
01/07/2025,A&E,4 hours,Midlands,RLT,George Eliot Hospital NHS Trust,6445,8472
