Date,Domain,Metric,Region,Provider Code,Provider Name,Numerator,Denominator
01/03/2025,A&E,4 hours,London,R1K,London North West University Healthcare NHS Trust,23861,30379
01/03/2025,A&E,4 hours,London,RP6,Moorfields Eye Hospital NHS Foundation Trust,5697,5789
01/03/2025,A&E,4 hours,London,RAL,Royal Free London NHS Foundation Trust,32146,42976
01/03/2025,A&E,4 hours,London,RJ7,St George's University Hospitals NHS Foundation Trust,11171,13356
01/03/2025,A&E,4 hours,London,RAS,The Hillingdon Hospitals NHS Foundation Trust,9949,13128
01/03/2025,A&E,4 hours,London,RRV,University College London Hospitals NHS Foundation Trust,13650.91,17552.23
01/03/2025,A&E,4 hours,London,RKE,Whittington Health NHS Trust,9397.93,12085.29
01/03/2025,A&E,4 hours,Midlands,RQ3,Birmingham Women's And Children's NHS Foundation Trust,6715.431,7371.431
01/03/2025,A&E,4 hours,Midlands,RFS,Chesterfield Royal Hospital NHS Foundation Trust,15501.89,19747.81
01/03/2025,A&E,4 hours,Midlands,RLT,George Eliot Hospital NHS Trust,5887,8872
01/03/2025,A&E,4 hours,Midlands,RNQ,Kettering General Hospital NHS Foundation Trust,15677,19547
01/03/2025,A&E,4 hours,Midlands,RNS,Northampton General Hospital NHS Trust,8945,13600
01/03/2025,A&E,4 hours,Midlands,RX1,Nottingham University Hospitals NHS Trust,16023,25706
01/03/2025,A&E,4 hours,Midlands,RXK,Sandwell And West Birmingham Hospitals NHS Trust,19408,24824
01/03/2025,A&E,4 hours,Midlands,RK5,Sherwood Forest Hospitals NHS Foundation Trust,13559,18037
01/03/2025,A&E,4 hours,Midlands,RXW,The Shrewsbury And Telford Hospital NHS Trust,10584,17235
01/03/2025,A&E,4 hours,Midlands,RJC,South Warwickshire University NHS Foundation Trust,6129,8861
01/03/2025,A&E,4 hours,Midlands,RNA,The Dudley Group NHS Foundation Trust,12345,15337
01/03/2025,A&E,4 hours,Midlands,RL4,The Royal Wolverhampton NHS Trust,18389,22536
01/03/2025,A&E,4 hours,Midlands,RWD,United Lincolnshire Teaching Hospitals NHS Trust,23325,29804
01/03/2025,A&E,4 hours,Midlands,RRK,University Hospitals Birmingham NHS Foundation Trust,35026.569,48917.569
01/03/2025,A&E,4 hours,Midlands,RKB,University Hospitals Coventry And Warwickshire NHS Trust,14977,20740
01/03/2025,A&E,4 hours,Midlands,RTG,University Hospitals Of Derby And Burton NHS Foundation Trust,28333.11,37592.19
01/03/2025,A&E,4 hours,Midlands,RWE,University Hospitals Of Leicester NHS Trust,31121,41329
01/03/2025,A&E,4 hours,Midlands,RJE,University Hospitals Of North Midlands NHS Trust,16412,25413
01/03/2025,A&E,4 hours,Midlands,RBK,Walsall Healthcare NHS Trust,10580,14050
01/03/2025,A&E,4 hours,Midlands,RWP,Worcestershire Acute Hospitals NHS Trust,13199,20008
01/03/2025,A&E,4 hours,Midlands,RLQ,Wye Valley NHS Trust,4820,7623
01/03/2025,A&E,4 hours,North East,RCF,Airedale NHS Foundation Trust,4124,6665
01/03/2025,A&E,4 hours,North East,RFF,Barnsley Hospital NHS Foundation Trust,7455,9293
01/03/2025,A&E,4 hours,North East,RAE,Bradford Teaching Hospitals NHS Foundation Trust,11237,13545
01/03/2025,A&E,4 hours,North East,RWY,Calderdale And Huddersfield NHS Foundation Trust,15774,18759
01/03/2025,A&E,4 hours,North East,RXP,County Durham And Darlington NHS Foundation Trust,20535,25748
01/03/2025,A&E,4 hours,North East,RP5,Doncaster And Bassetlaw Teaching Hospitals NHS Foundation Trust,13794,18457
01/03/2025,A&E,4 hours,North East,RR7,Gateshead Health NHS Foundation Trust,7382,9903
01/03/2025,A&E,4 hours,North East,RCD,Harrogate And District NHS Foundation Trust,5133,6505
01/03/2025,A&E,4 hours,North East,RWA,Hull University Teaching Hospitals NHS Trust,14212,21081
01/03/2025,A&E,4 hours,North East,RR8,Leeds Teaching Hospitals NHS Trust,25041,31586
01/03/2025,A&E,4 hours,North East,RXF,Mid Yorkshire Teaching NHS Trust,16665,23650
01/03/2025,A&E,4 hours,North East,RNN,North Cumbria Integrated Care NHS Foundation Trust,7538,11530
01/03/2025,A&E,4 hours,North East,RVW,North Tees And Hartlepool NHS Foundation Trust,14517,16958
01/03/2025,A&E,4 hours,North East,RJL,Northern Lincolnshire And Goole NHS Foundation Trust,13799,18655
01/03/2025,A&E,4 hours,North East,RTF,Northumbria Healthcare NHS Foundation Trust,21030,23568
01/03/2025,A&E,4 hours,North East,RCU,Sheffield Children's NHS Foundation Trust,5099,5630
01/03/2025,A&E,4 hours,North East,RHQ,Sheffield Teaching Hospitals NHS Foundation Trust,13896,19009
01/03/2025,A&E,4 hours,North East,RTR,South Tees Hospitals NHS Foundation Trust,14688,19267
01/03/2025,A&E,4 hours,North East,R0B,South Tyneside and Sunderland NHS Foundation Trust,15863,21350
01/03/2025,A&E,4 hours,North East,RTD,The Newcastle Upon Tyne Hospitals NHS Foundation Trust,16487,21262
01/03/2025,A&E,4 hours,North East,RFR,The Rotherham NHS Foundation Trust,6178,9434
01/03/2025,A&E,4 hours,North East,RCB,York And Scarborough Teaching Hospitals NHS Foundation Trust,13910,20403
01/03/2025,A&E,4 hours,North West,RBS,Alder Hey Children's NHS Foundation Trust,10336.72301,11789.95642
01/03/2025,A&E,4 hours,North West,RXL,Blackpool Teaching Hospitals NHS Foundation Trust,16531,20766
01/03/2025,A&E,4 hours,North West,RMC,Bolton NHS Foundation Trust,8859,12332
01/03/2025,A&E,4 hours,North West,RJR,Countess Of Chester Hospital NHS Foundation Trust,4574,7696
01/03/2025,A&E,4 hours,North West,RJN,East Cheshire NHS Trust,2361,4584
01/03/2025,A&E,4 hours,North West,RXR,East Lancashire Hospitals NHS Trust,19534,24513
01/03/2025,A&E,4 hours,North West,RXN,Lancashire Teaching Hospitals NHS Foundation Trust,10898,15778
01/03/2025,A&E,4 hours,North West,REM,Liverpool University Hospitals NHS Foundation Trust,22999.60952,31677.30267
01/03/2025,A&E,4 hours,North West,REP,Liverpool Women's NHS Foundation Trust,1456,1632
01/03/2025,A&E,4 hours,North West,R0A,Manchester University NHS Foundation Trust,33529,45364
01/03/2025,A&E,4 hours,North West,RBT,Mid Cheshire Hospitals NHS Foundation Trust,6259,10467
01/03/2025,A&E,4 hours,North West,RM3,Northern Care Alliance NHS Foundation Trust,24989,35836
01/03/2025,A&E,4 hours,North West,RBN,Mersey and West Lancashire Teaching Hospitals NHS Trust,25835.66747,32645.74091
01/03/2025,A&E,4 hours,North West,RWJ,Stockport NHS Foundation Trust,7658,11101
01/03/2025,A&E,4 hours,North West,RMP,Tameside And Glossop Integrated Care NHS Foundation Trust,8483,12316
01/03/2025,A&E,4 hours,North West,RTX,University Hospitals Of Morecambe Bay NHS Foundation Trust,10217,14157
01/03/2025,A&E,4 hours,North West,RWW,Warrington And Halton Teaching  Hospitals NHS Foundation Trust,8360,12228
01/03/2025,A&E,4 hours,North West,RBL,Wirral University Teaching Hospital NHS Foundation Trust,12914,17615
01/03/2025,A&E,4 hours,North West,RRF,"Wrightington, Wigan And Leigh NHS Foundation Trust",9172,12790
01/03/2025,A&E,4 hours,South East,RTK,Ashford And St Peter's Hospitals NHS Foundation Trust,12084,15814
01/03/2025,A&E,4 hours,South East,RXQ,Buckinghamshire Healthcare NHS Trust,12618,16000
01/03/2025,A&E,4 hours,South East,RN7,Dartford And Gravesham NHS Trust,12162,15873
01/03/2025,A&E,4 hours,South East,RVV,East Kent Hospitals University NHS Foundation Trust,30065.80123,36724.98342
01/03/2025,A&E,4 hours,South East,RXC,East Sussex Healthcare NHS Trust,11600,15898
01/03/2025,A&E,4 hours,South East,RDU,Frimley Health NHS Foundation Trust,26856,36779
01/03/2025,A&E,4 hours,South East,RN5,Hampshire Hospitals NHS Foundation Trust,9978,15090
01/03/2025,A&E,4 hours,South East,R1F,Isle Of Wight NHS Trust,4074,6057
01/03/2025,A&E,4 hours,South East,RWF,Maidstone And Tunbridge Wells NHS Trust,19467.5832,22710.13357
01/03/2025,A&E,4 hours,South East,RPA,Medway NHS Foundation Trust,18080.19877,22062.01658
01/03/2025,A&E,4 hours,South East,RTH,Oxford University Hospitals NHS Foundation Trust,15402.236,21614.168
01/03/2025,A&E,4 hours,South East,RHU,Portsmouth Hospitals University National Health Service Trust,21036,26471
01/03/2025,A&E,4 hours,South East,RHW,Royal Berkshire NHS Foundation Trust,16536.764,21852.832
01/03/2025,A&E,4 hours,South East,RA2,Royal Surrey County Hospital NHS Foundation Trust,7161,9442
01/03/2025,A&E,4 hours,South East,RTP,Surrey And Sussex Healthcare NHS Trust,18859.55513,22684.92264
01/03/2025,A&E,4 hours,South East,RHM,University Hospital Southampton NHS Foundation Trust,16480,22111
01/03/2025,A&E,4 hours,South East,RYR,University Hospitals Sussex NHS Foundation Trust,27076.86167,37887.94379
01/03/2025,A&E,4 hours,South West,RBD,Dorset County Hospital NHS Foundation Trust,7627,9043
01/03/2025,A&E,4 hours,South West,RTE,Gloucestershire Hospitals NHS Foundation Trust,17471,23003
01/03/2025,A&E,4 hours,South West,RN3,Great Western Hospitals NHS Foundation Trust,7928,11314
01/03/2025,A&E,4 hours,South West,RVJ,North Bristol NHS Trust,8435.5,12133.7
01/03/2025,A&E,4 hours,South West,RK9,University Hospitals Plymouth NHS Trust,9991,15188
01/03/2025,A&E,4 hours,South West,REF,Royal Cornwall Hospitals NHS Trust,14938,19141
01/03/2025,A&E,4 hours,South West,RH8,Royal Devon University Healthcare NHS Foundation Trust,14227,20318
01/03/2025,A&E,4 hours,South West,RD1,Royal United Hospitals Bath NHS Foundation Trust,6038,9675
01/03/2025,A&E,4 hours,South West,RNZ,Salisbury NHS Foundation Trust,5033,7090
01/03/2025,A&E,4 hours,South West,RH5,Somerset NHS Foundation Trust,16644,23053
01/03/2025,A&E,4 hours,South West,RA9,Torbay And South Devon NHS Foundation Trust,7380,10567
01/03/2025,A&E,4 hours,South West,R0D,University Hospitals Dorset NHS Foundation Trust,13865,19229
01/03/2025,A&E,4 hours,South West,RA7,University Hospitals Bristol and Weston NHS Foundation Trust,19186.5,25445.3
01/03/2025,Cancer,28 Days FDS,East,RC9,BEDFORDSHIRE HOSPITALS NHS FOUNDATION TRUST,1976,2606
01/03/2025,Cancer,28 Days FDS,East,RGT,CAMBRIDGE UNIVERSITY HOSPITALS NHS FOUNDATION TRUST,2157,2575
01/03/2025,Cancer,28 Days FDS,East,RWH,EAST AND NORTH HERTFORDSHIRE NHS TRUST,1338,1721
01/03/2025,Cancer,28 Days FDS,East,RDE,EAST SUFFOLK AND NORTH ESSEX NHS FOUNDATION TRUST,3527,4559
01/03/2025,Cancer,28 Days FDS,East,RGP,JAMES PAGET UNIVERSITY HOSPITALS NHS FOUNDATION TRUST,814,1059
01/03/2025,Cancer,28 Days FDS,East,RAJ,MID AND SOUTH ESSEX NHS FOUNDATION TRUST,4014,6128
01/03/2025,Cancer,28 Days FDS,East,RD8,MILTON KEYNES UNIVERSITY HOSPITAL NHS FOUNDATION TRUST,1231,1566
01/03/2025,Cancer,28 Days FDS,East,RM1,NORFOLK AND NORWICH UNIVERSITY HOSPITALS NHS FOUNDATION TRUST,2839,3424
01/03/2025,Cancer,28 Days FDS,East,RGN,NORTH WEST ANGLIA NHS FOUNDATION TRUST,1806,2289
01/03/2025,Cancer,28 Days FDS,East,RQW,THE PRINCESS ALEXANDRA HOSPITAL NHS TRUST,1207,1719
01/03/2025,Cancer,28 Days FDS,East,RCX,"THE QUEEN ELIZABETH HOSPITAL, KING'S LYNN, NHS FOUNDATION TRUST",1051,1458
01/03/2025,Cancer,28 Days FDS,East,RWG,WEST HERTFORDSHIRE TEACHING HOSPITALS NHS TRUST,1645,1937
01/03/2025,Cancer,28 Days FDS,East,RGR,WEST SUFFOLK NHS FOUNDATION TRUST,1086,1375
01/03/2025,Cancer,28 Days FDS,London,RF4,"BARKING, HAVERING AND REDBRIDGE UNIVERSITY HOSPITALS NHS TRUST",2131,2652
01/03/2025,Cancer,28 Days FDS,London,R1H,BARTS HEALTH NHS TRUST,2721,3383
01/03/2025,Cancer,28 Days FDS,London,RQM,CHELSEA AND WESTMINSTER HOSPITAL NHS FOUNDATION TRUST,2068,2585
01/03/2025,Cancer,28 Days FDS,London,RJ6,CROYDON HEALTH SERVICES NHS TRUST,1439,1676
01/03/2025,Cancer,28 Days FDS,London,RVR,EPSOM AND ST HELIER UNIVERSITY HOSPITALS NHS TRUST,1128,1369
01/03/2025,Cancer,28 Days FDS,London,RJ1,GUY'S AND ST THOMAS' NHS FOUNDATION TRUST,2108,2640
01/03/2025,Cancer,28 Days FDS,London,RQX,HOMERTON HEALTHCARE NHS FOUNDATION TRUST,1175,1452
01/03/2025,Cancer,28 Days FDS,London,RYJ,IMPERIAL COLLEGE HEALTHCARE NHS TRUST,2308,2788
01/03/2025,Cancer,28 Days FDS,London,RJZ,KING'S COLLEGE HOSPITAL NHS FOUNDATION TRUST,2672,3391
01/03/2025,Cancer,28 Days FDS,London,RAX,KINGSTON AND RICHMOND NHS FOUNDATION TRUST,1597,1813
01/03/2025,Cancer,28 Days FDS,London,RJ2,LEWISHAM AND GREENWICH NHS TRUST,2421,3128
01/03/2025,Cancer,28 Days FDS,London,R1K,LONDON NORTH WEST UNIVERSITY HEALTHCARE NHS TRUST,2589,3216
01/03/2025,Cancer,28 Days FDS,London,RAL,ROYAL FREE LONDON NHS FOUNDATION TRUST,4417,5765
01/03/2025,Cancer,28 Days FDS,London,RJ7,ST GEORGE'S UNIVERSITY HOSPITALS NHS FOUNDATION TRUST,1633,1926
01/03/2025,Cancer,28 Days FDS,London,RAS,THE HILLINGDON HOSPITALS NHS FOUNDATION TRUST,1063,1303
01/03/2025,Cancer,28 Days FDS,London,RRV,UNIVERSITY COLLEGE LONDON HOSPITALS NHS FOUNDATION TRUST,1597,1891
01/03/2025,Cancer,28 Days FDS,London,RKE,WHITTINGTON HEALTH NHS TRUST,951,1185
01/03/2025,Cancer,28 Days FDS,Midlands,RFS,CHESTERFIELD ROYAL HOSPITAL NHS FOUNDATION TRUST,1015,1319
01/03/2025,Cancer,28 Days FDS,Midlands,RLT,GEORGE ELIOT HOSPITAL NHS TRUST,365,513
01/03/2025,Cancer,28 Days FDS,Midlands,RNQ,KETTERING GENERAL HOSPITAL NHS FOUNDATION TRUST,1155,1381
01/03/2025,Cancer,28 Days FDS,Midlands,RNS,NORTHAMPTON GENERAL HOSPITAL NHS TRUST,1824,2042
01/03/2025,Cancer,28 Days FDS,Midlands,RX1,NOTTINGHAM UNIVERSITY HOSPITALS NHS TRUST,2480,3089
01/03/2025,Cancer,28 Days FDS,Midlands,RXK,SANDWELL AND WEST BIRMINGHAM HOSPITALS NHS TRUST,1246,1618
01/03/2025,Cancer,28 Days FDS,Midlands,RK5,SHERWOOD FOREST HOSPITALS NHS FOUNDATION TRUST,1411,1809
01/03/2025,Cancer,28 Days FDS,Midlands,RJC,SOUTH WARWICKSHIRE UNIVERSITY NHS FOUNDATION TRUST,1273,1615
01/03/2025,Cancer,28 Days FDS,Midlands,RNA,THE DUDLEY GROUP NHS FOUNDATION TRUST,1539,1775
01/03/2025,Cancer,28 Days FDS,Midlands,RL4,THE ROYAL WOLVERHAMPTON NHS TRUST,1630,2069
01/03/2025,Cancer,28 Days FDS,Midlands,RXW,THE SHREWSBURY AND TELFORD HOSPITAL NHS TRUST,2081,3330
01/03/2025,Cancer,28 Days FDS,Midlands,RWD,UNITED LINCOLNSHIRE TEACHING HOSPITALS NHS TRUST                     ,2227,2855
01/03/2025,Cancer,28 Days FDS,Midlands,RRK,UNIVERSITY HOSPITALS BIRMINGHAM NHS FOUNDATION TRUST,3336,4120
01/03/2025,Cancer,28 Days FDS,Midlands,RKB,UNIVERSITY HOSPITALS COVENTRY AND WARWICKSHIRE NHS TRUST,2091,2701
01/03/2025,Cancer,28 Days FDS,Midlands,RTG,UNIVERSITY HOSPITALS OF DERBY AND BURTON NHS FOUNDATION TRUST,3024,4024
01/03/2025,Cancer,28 Days FDS,Midlands,RWE,UNIVERSITY HOSPITALS OF LEICESTER NHS TRUST,3623,4408
01/03/2025,Cancer,28 Days FDS,Midlands,RJE,UNIVERSITY HOSPITALS OF NORTH MIDLANDS NHS TRUST,2819,3729
01/03/2025,Cancer,28 Days FDS,Midlands,RBK,WALSALL HEALTHCARE NHS TRUST,553,647
01/03/2025,Cancer,28 Days FDS,Midlands,RWP,WORCESTERSHIRE ACUTE HOSPITALS NHS TRUST,2087,2645
01/03/2025,Cancer,28 Days FDS,Midlands,RLQ,WYE VALLEY NHS TRUST,777,1010
01/03/2025,Cancer,28 Days FDS,North East,RCF,AIREDALE NHS FOUNDATION TRUST,586,718
01/03/2025,Cancer,28 Days FDS,North East,RFF,BARNSLEY HOSPITAL NHS FOUNDATION TRUST,882,1133
01/03/2025,Cancer,28 Days FDS,North East,RAE,BRADFORD TEACHING HOSPITALS NHS FOUNDATION TRUST,1470,1782
01/03/2025,Cancer,28 Days FDS,North East,RWY,CALDERDALE AND HUDDERSFIELD NHS FOUNDATION TRUST,1717,2145
01/03/2025,Cancer,28 Days FDS,North East,RXP,COUNTY DURHAM AND DARLINGTON NHS FOUNDATION TRUST,1488,1872
01/03/2025,Cancer,28 Days FDS,North East,RP5,DONCASTER AND BASSETLAW TEACHING HOSPITALS NHS FOUNDATION TRUST,1333,1778
01/03/2025,Cancer,28 Days FDS,North East,RR7,GATESHEAD HEALTH NHS FOUNDATION TRUST,1062,1332
01/03/2025,Cancer,28 Days FDS,North East,RCD,HARROGATE AND DISTRICT NHS FOUNDATION TRUST,1018,1290
01/03/2025,Cancer,28 Days FDS,North East,RWA,HULL UNIVERSITY TEACHING HOSPITALS NHS TRUST,2033,2597
01/03/2025,Cancer,28 Days FDS,North East,RR8,LEEDS TEACHING HOSPITALS NHS TRUST,3347,3981
01/03/2025,Cancer,28 Days FDS,North East,RXF,MID YORKSHIRE TEACHING NHS TRUST,1976,2436
01/03/2025,Cancer,28 Days FDS,North East,RNN,NORTH CUMBRIA INTEGRATED CARE NHS FOUNDATION TRUST,1054,1470
01/03/2025,Cancer,28 Days FDS,North East,RVW,NORTH TEES AND HARTLEPOOL NHS FOUNDATION TRUST,1264,1589
01/03/2025,Cancer,28 Days FDS,North East,RJL,NORTHERN LINCOLNSHIRE AND GOOLE NHS FOUNDATION TRUST,800,1333
01/03/2025,Cancer,28 Days FDS,North East,RTF,NORTHUMBRIA HEALTHCARE NHS FOUNDATION TRUST,1518,1778
01/03/2025,Cancer,28 Days FDS,North East,RHQ,SHEFFIELD TEACHING HOSPITALS NHS FOUNDATION TRUST,1762,2353
01/03/2025,Cancer,28 Days FDS,North East,RTR,SOUTH TEES HOSPITALS NHS FOUNDATION TRUST,1123,1580
01/03/2025,Cancer,28 Days FDS,North East,R0B,SOUTH TYNESIDE AND SUNDERLAND NHS FOUNDATION TRUST,1137,1475
01/03/2025,Cancer,28 Days FDS,North East,RTD,THE NEWCASTLE UPON TYNE HOSPITALS NHS FOUNDATION TRUST,2242,2773
01/03/2025,Cancer,28 Days FDS,North East,RFR,THE ROTHERHAM NHS FOUNDATION TRUST,893,1104
01/03/2025,Cancer,28 Days FDS,North East,RCB,YORK AND SCARBOROUGH TEACHING HOSPITALS NHS FOUNDATION TRUST,1461,2070
01/03/2025,Cancer,28 Days FDS,North West,RXL,BLACKPOOL TEACHING HOSPITALS NHS FOUNDATION TRUST,1485,1975
01/03/2025,Cancer,28 Days FDS,North West,RMC,BOLTON NHS FOUNDATION TRUST,1661,1835
01/03/2025,Cancer,28 Days FDS,North West,RJR,COUNTESS OF CHESTER HOSPITAL NHS FOUNDATION TRUST,1254,1479
01/03/2025,Cancer,28 Days FDS,North West,RJN,EAST CHESHIRE NHS TRUST,634,798
01/03/2025,Cancer,28 Days FDS,North West,RXR,EAST LANCASHIRE HOSPITALS NHS TRUST,1735,2220
01/03/2025,Cancer,28 Days FDS,North West,RXN,LANCASHIRE TEACHING HOSPITALS NHS FOUNDATION TRUST,1857,2259
01/03/2025,Cancer,28 Days FDS,North West,REM,LIVERPOOL UNIVERSITY HOSPITALS NHS FOUNDATION TRUST,3046,4036
01/03/2025,Cancer,28 Days FDS,North West,R0A,MANCHESTER UNIVERSITY NHS FOUNDATION TRUST,4547,5983
01/03/2025,Cancer,28 Days FDS,North West,RBN,MERSEY AND WEST LANCASHIRE TEACHING HOSPITALS NHS TRUST,2310,3123
01/03/2025,Cancer,28 Days FDS,North West,RBT,MID CHESHIRE HOSPITALS NHS FOUNDATION TRUST,1365,1815
01/03/2025,Cancer,28 Days FDS,North West,RM3,NORTHERN CARE ALLIANCE NHS FOUNDATION TRUST,3043,3939
01/03/2025,Cancer,28 Days FDS,North West,RWJ,STOCKPORT NHS FOUNDATION TRUST,917,1117
01/03/2025,Cancer,28 Days FDS,North West,RMP,TAMESIDE AND GLOSSOP INTEGRATED CARE NHS FOUNDATION TRUST,1128,1308
01/03/2025,Cancer,28 Days FDS,North West,RTX,UNIVERSITY HOSPITALS OF MORECAMBE BAY NHS FOUNDATION TRUST,1581,1874
01/03/2025,Cancer,28 Days FDS,North West,RWW,WARRINGTON AND HALTON TEACHING HOSPITALS NHS FOUNDATION TRUST,809,1091
01/03/2025,Cancer,28 Days FDS,North West,RBL,WIRRAL UNIVERSITY TEACHING HOSPITAL NHS FOUNDATION TRUST,1466,1950
01/03/2025,Cancer,28 Days FDS,North West,RRF,"WRIGHTINGTON, WIGAN AND LEIGH NHS FOUNDATION TRUST",1403,1640
01/03/2025,Cancer,28 Days FDS,South East,RTK,ASHFORD AND ST PETER'S HOSPITALS NHS FOUNDATION TRUST,1566,1874
01/03/2025,Cancer,28 Days FDS,South East,RXQ,BUCKINGHAMSHIRE HEALTHCARE NHS TRUST,1759,2273
01/03/2025,Cancer,28 Days FDS,South East,RN7,DARTFORD AND GRAVESHAM NHS TRUST,830,1109
01/03/2025,Cancer,28 Days FDS,South East,RVV,EAST KENT HOSPITALS UNIVERSITY NHS FOUNDATION TRUST,3288,4306
01/03/2025,Cancer,28 Days FDS,South East,RXC,EAST SUSSEX HEALTHCARE NHS TRUST,2232,2694
01/03/2025,Cancer,28 Days FDS,South East,RDU,FRIMLEY HEALTH NHS FOUNDATION TRUST,2846,3497
01/03/2025,Cancer,28 Days FDS,South East,RN5,HAMPSHIRE HOSPITALS NHS FOUNDATION TRUST,1735,2144
01/03/2025,Cancer,28 Days FDS,South East,R1F,ISLE OF WIGHT NHS TRUST,518,630
01/03/2025,Cancer,28 Days FDS,South East,RWF,MAIDSTONE AND TUNBRIDGE WELLS NHS TRUST,1826,2345
01/03/2025,Cancer,28 Days FDS,South East,RPA,MEDWAY NHS FOUNDATION TRUST,1100,1661
01/03/2025,Cancer,28 Days FDS,South East,RTH,OXFORD UNIVERSITY HOSPITALS NHS FOUNDATION TRUST,2647,3345
01/03/2025,Cancer,28 Days FDS,South East,RHU,PORTSMOUTH HOSPITALS UNIVERSITY NATIONAL HEALTH SERVICE TRUST,2212,2831
01/03/2025,Cancer,28 Days FDS,South East,RHW,ROYAL BERKSHIRE NHS FOUNDATION TRUST,1823,2234
01/03/2025,Cancer,28 Days FDS,South East,RA2,ROYAL SURREY COUNTY HOSPITAL NHS FOUNDATION TRUST,920,1096
01/03/2025,Cancer,28 Days FDS,South East,RTP,SURREY AND SUSSEX HEALTHCARE NHS TRUST,2106,2451
01/03/2025,Cancer,28 Days FDS,South East,RHM,UNIVERSITY HOSPITAL SOUTHAMPTON NHS FOUNDATION TRUST,1946,2344
01/03/2025,Cancer,28 Days FDS,South East,RYR,UNIVERSITY HOSPITALS SUSSEX NHS FOUNDATION TRUST,4542,5683
01/03/2025,Cancer,28 Days FDS,South West,RBD,DORSET COUNTY HOSPITAL NHS FOUNDATION TRUST,943,1203
01/03/2025,Cancer,28 Days FDS,South West,RTE,GLOUCESTERSHIRE HOSPITALS NHS FOUNDATION TRUST,2189,2700
01/03/2025,Cancer,28 Days FDS,South West,RN3,GREAT WESTERN HOSPITALS NHS FOUNDATION TRUST,1343,1608
01/03/2025,Cancer,28 Days FDS,South West,RVJ,NORTH BRISTOL NHS TRUST,2543,3068
01/03/2025,Cancer,28 Days FDS,South West,REF,ROYAL CORNWALL HOSPITALS NHS TRUST,2033,2486
01/03/2025,Cancer,28 Days FDS,South West,RH8,ROYAL DEVON UNIVERSITY HEALTHCARE NHS FOUNDATION TRUST,2895,3556
01/03/2025,Cancer,28 Days FDS,South West,RD1,ROYAL UNITED HOSPITALS BATH NHS FOUNDATION TRUST,1493,2109
01/03/2025,Cancer,28 Days FDS,South West,RNZ,SALISBURY NHS FOUNDATION TRUST,896,1178
01/03/2025,Cancer,28 Days FDS,South West,RH5,SOMERSET NHS FOUNDATION TRUST,1854,2459
01/03/2025,Cancer,28 Days FDS,South West,RA9,TORBAY AND SOUTH DEVON NHS FOUNDATION TRUST,1405,1775
01/03/2025,Cancer,28 Days FDS,South West,RA7,UNIVERSITY HOSPITALS BRISTOL AND WESTON NHS FOUNDATION TRUST,1565,2000
01/03/2025,Cancer,28 Days FDS,South West,R0D,UNIVERSITY HOSPITALS DORSET NHS FOUNDATION TRUST,2262,2835
01/03/2025,Cancer,28 Days FDS,South West,RK9,UNIVERSITY HOSPITALS PLYMOUTH NHS TRUST,2394,2914
01/03/2025,Cancer,31 Days,East,RC9,BEDFORDSHIRE HOSPITALS NHS FOUNDATION TRUST,302,307
01/03/2025,Cancer,31 Days,East,RGT,CAMBRIDGE UNIVERSITY HOSPITALS NHS FOUNDATION TRUST,675,803
01/03/2025,Cancer,31 Days,East,RWH,EAST AND NORTH HERTFORDSHIRE NHS TRUST,848,883
01/03/2025,Cancer,31 Days,East,RDE,EAST SUFFOLK AND NORTH ESSEX NHS FOUNDATION TRUST,810,864
01/03/2025,Cancer,31 Days,East,RGP,JAMES PAGET UNIVERSITY HOSPITALS NHS FOUNDATION TRUST,203,216
01/03/2025,Cancer,31 Days,East,RAJ,MID AND SOUTH ESSEX NHS FOUNDATION TRUST,669,911
01/03/2025,Cancer,31 Days,East,RD8,MILTON KEYNES UNIVERSITY HOSPITAL NHS FOUNDATION TRUST,205,212
01/03/2025,Cancer,31 Days,East,RM1,NORFOLK AND NORWICH UNIVERSITY HOSPITALS NHS FOUNDATION TRUST,456,545
01/03/2025,Cancer,31 Days,East,RGN,NORTH WEST ANGLIA NHS FOUNDATION TRUST,286,335
01/03/2025,Cancer,31 Days,East,RQW,THE PRINCESS ALEXANDRA HOSPITAL NHS TRUST,138,153
01/03/2025,Cancer,31 Days,East,RCX,"THE QUEEN ELIZABETH HOSPITAL, KING'S LYNN, NHS FOUNDATION TRUST",152,166
01/03/2025,Cancer,31 Days,East,RWG,WEST HERTFORDSHIRE TEACHING HOSPITALS NHS TRUST,203,208
01/03/2025,Cancer,31 Days,East,RGR,WEST SUFFOLK NHS FOUNDATION TRUST,247,248
01/03/2025,Cancer,31 Days,London,RF4,"BARKING, HAVERING AND REDBRIDGE UNIVERSITY HOSPITALS NHS TRUST",390,394
01/03/2025,Cancer,31 Days,London,R1H,BARTS HEALTH NHS TRUST,490,505
01/03/2025,Cancer,31 Days,London,RQM,CHELSEA AND WESTMINSTER HOSPITAL NHS FOUNDATION TRUST,147,152
01/03/2025,Cancer,31 Days,London,RJ6,CROYDON HEALTH SERVICES NHS TRUST,98,100
01/03/2025,Cancer,31 Days,London,RVR,EPSOM AND ST HELIER UNIVERSITY HOSPITALS NHS TRUST,87,87
01/03/2025,Cancer,31 Days,London,RJ1,GUY'S AND ST THOMAS' NHS FOUNDATION TRUST,930,1019
01/03/2025,Cancer,31 Days,London,RQX,HOMERTON HEALTHCARE NHS FOUNDATION TRUST,59,59
01/03/2025,Cancer,31 Days,London,RYJ,IMPERIAL COLLEGE HEALTHCARE NHS TRUST,781,809
01/03/2025,Cancer,31 Days,London,RJZ,KING'S COLLEGE HOSPITAL NHS FOUNDATION TRUST,355,379
01/03/2025,Cancer,31 Days,London,RAX,KINGSTON AND RICHMOND NHS FOUNDATION TRUST,140,141
01/03/2025,Cancer,31 Days,London,RJ2,LEWISHAM AND GREENWICH NHS TRUST,102,106
01/03/2025,Cancer,31 Days,London,R1K,LONDON NORTH WEST UNIVERSITY HEALTHCARE NHS TRUST,175,176
01/03/2025,Cancer,31 Days,London,RAL,ROYAL FREE LONDON NHS FOUNDATION TRUST,752,837
01/03/2025,Cancer,31 Days,London,RJ7,ST GEORGE'S UNIVERSITY HOSPITALS NHS FOUNDATION TRUST,397,409
01/03/2025,Cancer,31 Days,London,RAS,THE HILLINGDON HOSPITALS NHS FOUNDATION TRUST,96,101
01/03/2025,Cancer,31 Days,London,RRV,UNIVERSITY COLLEGE LONDON HOSPITALS NHS FOUNDATION TRUST,542,563
01/03/2025,Cancer,31 Days,London,RKE,WHITTINGTON HEALTH NHS TRUST,46,47
01/03/2025,Cancer,31 Days,Midlands,RFS,CHESTERFIELD ROYAL HOSPITAL NHS FOUNDATION TRUST,159,181
01/03/2025,Cancer,31 Days,Midlands,RLT,GEORGE ELIOT HOSPITAL NHS TRUST,61,61
01/03/2025,Cancer,31 Days,Midlands,RNQ,KETTERING GENERAL HOSPITAL NHS FOUNDATION TRUST,184,195
01/03/2025,Cancer,31 Days,Midlands,RNS,NORTHAMPTON GENERAL HOSPITAL NHS TRUST,420,463
01/03/2025,Cancer,31 Days,Midlands,RX1,NOTTINGHAM UNIVERSITY HOSPITALS NHS TRUST,824,926
01/03/2025,Cancer,31 Days,Midlands,RXK,SANDWELL AND WEST BIRMINGHAM HOSPITALS NHS TRUST,144,151
01/03/2025,Cancer,31 Days,Midlands,RK5,SHERWOOD FOREST HOSPITALS NHS FOUNDATION TRUST,124,130
01/03/2025,Cancer,31 Days,Midlands,RJC,SOUTH WARWICKSHIRE UNIVERSITY NHS FOUNDATION TRUST,138,149
01/03/2025,Cancer,31 Days,Midlands,RNA,THE DUDLEY GROUP NHS FOUNDATION TRUST,235,250
01/03/2025,Cancer,31 Days,Midlands,RL4,THE ROYAL WOLVERHAMPTON NHS TRUST,495,549
01/03/2025,Cancer,31 Days,Midlands,RXW,THE SHREWSBURY AND TELFORD HOSPITAL NHS TRUST,602,623
01/03/2025,Cancer,31 Days,Midlands,RWD,UNITED LINCOLNSHIRE TEACHING HOSPITALS NHS TRUST                     ,555,625
01/03/2025,Cancer,31 Days,Midlands,RRK,UNIVERSITY HOSPITALS BIRMINGHAM NHS FOUNDATION TRUST,1236,1382
01/03/2025,Cancer,31 Days,Midlands,RKB,UNIVERSITY HOSPITALS COVENTRY AND WARWICKSHIRE NHS TRUST,619,646
01/03/2025,Cancer,31 Days,Midlands,RTG,UNIVERSITY HOSPITALS OF DERBY AND BURTON NHS FOUNDATION TRUST,754,862
01/03/2025,Cancer,31 Days,Midlands,RWE,UNIVERSITY HOSPITALS OF LEICESTER NHS TRUST,685,858
01/03/2025,Cancer,31 Days,Midlands,RJE,UNIVERSITY HOSPITALS OF NORTH MIDLANDS NHS TRUST,696,729
01/03/2025,Cancer,31 Days,Midlands,RBK,WALSALL HEALTHCARE NHS TRUST,88,91
01/03/2025,Cancer,31 Days,Midlands,RWP,WORCESTERSHIRE ACUTE HOSPITALS NHS TRUST,463,534
01/03/2025,Cancer,31 Days,Midlands,RLQ,WYE VALLEY NHS TRUST,112,123
01/03/2025,Cancer,31 Days,North East,RCF,AIREDALE NHS FOUNDATION TRUST,105,110
01/03/2025,Cancer,31 Days,North East,RFF,BARNSLEY HOSPITAL NHS FOUNDATION TRUST,111,117
01/03/2025,Cancer,31 Days,North East,RAE,BRADFORD TEACHING HOSPITALS NHS FOUNDATION TRUST,219,229
01/03/2025,Cancer,31 Days,North East,RWY,CALDERDALE AND HUDDERSFIELD NHS FOUNDATION TRUST,326,332
